;StockCode;Description
327283;23637;SET 10 CARDS OUT OF ORDER 17216
361659;23638;SET 10 CARDS ROBIN WATERPUMP  17096
341412;23639;SET 10 CARDS MAGICAL TREE 17086
328506;23640;SET 10 CARDS SCOTTIE DOG 17211
428976;23643;SET 10 CARDS CHRISTMAS BAUBLE 16954
368828;23644;SET 10 CARDS CHRISTMAS TREE 16955
421114;23645;SET 10 CHRISTMAS CARDS HOHOHO 16956
328765;23646;SET 10 CARDS JINGLE BELLS 16957
468699;23649;SET 10 CARDS DECK THE HALLS 16960
361660;23650;SET 10 CARDS FILIGREE BAUBLE 16961
475730;23652;SET 10 CARD CHRISTMAS STAMPS 16963
421116;23654;SET 10 CARD SNOWMAN 16965
393889;23660;HENRIETTA HEN MUG 
393890;23661;MILK MAIDS MUG 
458014;23664;FLOWER SHOP DESIGN MUG
440469;23681;LUNCH BAG RED VINTAGE DOILY
434510;23691;WRAP KEEP CALM BIRTHDAY
431680;23691;KEEP CALM BIRTHDAY WRAP
449375;23692;WRAP A PRETTY THANK YOU
463278;23694;PAISLEY PARK CARD
450157;23695;DOILY THANK YOU CARD
450197;23697;A PRETTY THANK YOU CARD
404067;23702;High Resolution Image
537904;23843;PAPER CRAFT , LITTLE BIRDIE
4456;35001G;HAND OPEN SHAPE GOLD
10092;35001W;HAND OPEN SHAPE DECO.WHITE
296;35004B;SET OF 3 BLACK FLYING DUCKS
154;35004C;SET OF 3 COLOURED  FLYING DUCKS
201;35004G;SET OF 3 GOLD FLYING DUCKS
23795;35004P;SET OF 3 PINK FLYING DUCKS
1712;35095A;BLUE VICTORIAN FABRIC OVAL BOX
1713;35095B;RED VICTORIAN FABRIC OVAL BOX
7422;35241;ENAMEL BLUE RIM BISCUIT BIN
52945;35265;COLOURFUL FLOWER FRUIT BOWL
3093;35271S;GOLD PRINT PAPER BAG
11754;35400;WOODEN BOX ADVENT CALENDAR 
42199;35443;RASTA IN BATH W SPLIFF ASHTRAY
1714;35471D;SET OF 3 BIRD LIGHT PINK FEATHER 
628;35591T;TURQUOISE CHRISTMAS TREE 
11820;35597A;DUSTY PINK CHRISTMAS TREE 30CM
11832;35597B;BLACKCHRISTMAS TREE 30CM
300475;35597D;PINK/WHITE CHRISTMAS TREE 30CM
470889;35598A;DUSTY PINK CHRISTMAS TREE 60CM
2262;35598B;BLACK CHRISTMAS TREE 60CM
461815;35598C;WHITE CHRISTMAS TREE 60CM
1715;35598D;PINK/WHITE CHRISTMAS TREE 60CM
6002;35599B;BLACK CHRISTMAS TREE 120CM
1716;35599D;PINK AND WHITE CHRISTMAS TREE 120CM
33779;35607A;PINK FLUFFY CHRISTMAS DECORATION
109979;35607B;BLACK FEATHER CHRISTMAS DECORATION
24570;35609A;PINK FEATHER CHRISTMAS DECORATION
1717;35610A;PINK CHRISTMAS FLOCK DROPLET 
27109;35610B;BLACK CHRISTMAS FLOCK DROPLET 
24572;35610C;WHITE CHRISTMAS FLOCK DROPLET 
2873;35637A;IVORY STRING CURTAIN WITH POLE 
75897;35637C;PINK STRING CURTAIN WITH POLE
95320;35638A;PINK AND BLACK STRING CURTAIN
261163;35638B;PINK/BLUE STRING CURTAIN 
257141;35645;VINTAGE BEAD PINK JEWEL BOX
13982;35646;VINTAGE BEAD PINK EVENING BAG
67893;35647;VINTAGE BEAD PINK SHADE 
10626;35648;VINTAGE BEAD PINK PURSE 
142368;35649;VINTAGE BEAD COSMETIC BAG 
284035;35650;VINTAGE BEAD PINK JEWEL STAND
10627;35651;VINTAGE BEAD PINK SCARF 
8448;35653;VINTAGE BEAD NOTEBOOK
15380;35809A;ENAMEL PINK TEA CONTAINER
143551;35809B;ENAMEL BLUE RIM TEA CONTAINER
21749;35809a;ENAMEL PINK TEA CONTAINER
33639;35810A;ENAMEL PINK COFFEE CONTAINER
7421;35810B;ENAMEL BLUE RIM COFFEE CONTAINER
83753;35815P;ACRYLIC JEWEL SNOWFLAKE, PINK
298032;35816P;ACRYLIC JEWEL ANGEL,PINK
298031;35817P;PINK ACRYLIC JEWEL SNOWFLAKE
31351;35817P;ACRYLIC JEWEL SNOWFLAKE,PINK
300939;35818B;ACRYLIC JEWEL ICICLE, BLUE
1718;35818P;ACRYLIC JEWEL ICICLE, PINK
39056;35819B;ACRYLIC HANGING JEWEL,BLUE
342880;35819P;ACRYLIC HANGING JEWEL,PINK
29097;35832;WOOLLY HAT SOCK GLOVE ADVENT STRING
11218;35833G;4 GOLD FLOCK CHRISTMAS BALLS
15381;35833P;4 PINK FLOCK CHRISTMAS BALLS
44668;35909A;RABBIT EASTER DECORATION
89218;35909B;PINK FLOWERS RABBIT EASTER
44669;35910A;MULTICOLOUR EASTER RABBIT 
124375;35910B;PINK FLOWERS RABBIT EASTER
32657;35911A;MULTICOLOUR RABBIT EGG WARMER
44064;35911B;PINK/FLOWER RABBIT EGG WARMER 
55559;35912B;WHITE/PINK CHICK DECORATION
70374;35913B;WHITE/PINK CHICK EASTER DECORATION
13706;35914;PINK CHICK EGG WARMER + EGG CUP
23433;35915B;BLUE KNITTED HEN 
51679;35915C;PEACH KNITTED HEN 
11219;35916A;YELLOW FELT HANGING HEART W FLOWER
216085;35916B;BLUE FELT HANGING HEART WITH FLOWER
2874;35916B;BLUE FELT HANGING HEART W FLOWER
2875;35916C;PINK FELT HANGING HEART W FLOWER
63898;35920;FOUR RABBIT EASTER DECORATIONS
58426;35921;EASTER BUNNY HANGING GARLAND
58607;35922;EASTER BUNNY WREATH
50254;35923;CANDY HEART HANGING DECORATION
9187;35924;HANGING FAIRY CAKE DECORATION
35832;35933;PINK STOCKING CHRISTMAS DECORATION
8728;35953;FOLKART STAR CHRISTMAS DECORATIONS
2252;35954;SMALL FOLKART STAR CHRISTMAS DEC
1719;35957;SMALLFOLKART BAUBLE CHRISTMAS DEC
8885;35958;FOLKART ZINC STAR CHRISTMAS DEC
1720;35961;FOLKART ZINC HEART CHRISTMAS DEC
2878;35964;FOLKART CLIP ON STARS
2879;35965;FOLKART HEART NAPKIN RINGS
218768;35966;FOLKART CHRISTMAS TREE T-LIGHT HOLD
2880;35967;FOLK ART METAL STAR T-LIGHT HOLDER
18017;35968;FOLK ART METAL HEART T-LIGHT HOLDER
6923;35970;ZINC FOLKART SLEIGH BELLS
1721;35971;ROSE FOLKART HEART DECORATIONS
44770;35972;DAISY FOLKART HEART DECORATION
10060;37327;ASSTD MULTICOLOUR CIRCLES MUG
128065;37330;BIG POLKADOT MUG
21200;37333;"RETRO ""TEA FOR ONE"" "
14787;37340;MULTICOLOUR SPRING FLOWER MUG
32993;37342;POLKADOT COFFEE CUP & SAUCER PINK
1359;37343;POLKADOT MUG PINK 
71161;37351;ORANGE FLOWER MUG 
53;37370;RETRO COFFEE MUGS ASSORTED
63821;37379A;PINK CHERRY BLOSSOM CUP & SAUCER
82936;37413;ICON MUG REVOLUTIONARY
108636;37423;WHITE WITH BLACK CATS PLATE
120;37444A;YELLOW BREAKFAST CUP AND SAUCER
21197;37444B;BLUE BREAKFAST CUP AND SAUCER 
121;37444C;PINK BREAKFAST CUP AND SAUCER 
2139;37446;MINI CAKE STAND WITH HANGING CAKES
10637;37447;CERAMIC CAKE DESIGN SPOTTED PLATE
2364;37448;CERAMIC CAKE DESIGN SPOTTED MUG
1723;37449;CERAMIC CAKE STAND + HANGING CAKES
2884;37450;CERAMIC CAKE BOWL + HANGING CAKES
9604;37461;FUNKY MONKEY MUG
13715;37462E;PET MUG, GOLDFISH
6420;37464;ROBOT MUG IN DISPLAY BOX
16530;37467;PIG MUG IN TWO COLOUR DESIGNS
56653;37468;HARDMAN MUG 3 ASSORTED
170766;37471;MULTICOLOUR POLKADOT PLATE
13716;37474;SET/4 2 TONE EGG SHAPE MIXING BOWLS
22989;37475;SET/4 COLOURFUL MIXING BOWLS
1724;37476;CONDIMENT TRAY 4 BOWLS AND 4 SPOONS
11553;37479B;CUBIC MUG FLOCK BLUE ON BROWN
14372;37479P;CUBIC MUG FLOCK PINK ON BROWN
11554;37482P;CUBIC MUG PINK POLKADOT
151599;37487B;YELLOW/ORANGE FLOWER DESIGN PLATE
125187;37488A;YELLOW PINK FLOWER DESIGN BIG BOWL
6473;37489A;YELLOW/PINK FLOWER DESIGN BIG MUG
6460;37489B;BLUE/YELLOW FLOWER DESIGN BIG MUG
6461;37489C;GREEN/BLUE FLOWER DESIGN BIG MUG
6452;37489D;PINK/GREEN FLOWER DESIGN BIG MUG
2885;37491A;YELLOW/PINK CERAMIC CANDLE HOLDER
266613;37491B;BLUE/YELLOW CERAMIC CANDLE HOLDER
266614;37491C;GREEN/BLUE CERAMIC CANDLE HOLDER
94513;37491D;PURPLE/BLUE CERAMIC CANDLE HOLDER
1378;37495;FAIRY CAKE BIRTHDAY CANDLE SET
15387;37500;TEA TIME TEAPOT IN GIFT BOX
15388;37501;TEA TIME TEA SET IN GIFT BOX
30945;37503;TEA TIME CAKE STAND IN GIFT BOX
9286;37509;NEW ENGLAND MUG W GIFT BOX
3083;40001;WHITE BAMBOO RIBS LAMPSHADE
20199;40003;WHITE BAMBOO RIBS LAMPSHADE
12563;40005B;BLUE ORGANDY ROUND LAMPSHADE W BEA
3748;40016;CHINESE DRAGON PAPER LANTERNS
66433;40046A;RED DAISY PAPER LAMPSHADE
79757;44089A;PINK GAUZE BUTTERFLY LAMPSHADE
88133;44089C;LILAC GAUZE BUTTERFLY LAMPSHADE
51292;44091A;BLUE CRUSOE CHECK LAMPSHADE
95104;44092B;BLUE WHITE PLASTIC RINGS LAMPSHADE
94575;44092C;PURPLE/COPPER HANGING LAMPSHADE
38358;44228;CANNABIS LEAF BEAD CURTAIN
6008;44234;ASSORTED CIRCULAR MOBILE
20171;44235;ASS COL CIRCLE MOBILE 
291684;44235;ASSORTED COLOURED CIRCLE MOBILE 
88134;44236;PINK/PURPLE CIRCLE CURTAIN
256408;44242A;LILAC FEATHERS CURTAIN
155445;44242B;PINK FEATHERS CURTAIN
86726;44265;M/COLOUR POM-POM CURTAIN
86024;45013;FOLDING SHOE TIDY
917;46000M;POLYESTER FILLER PAD 45x45cm
12512;46000P;POLYESTER FILLER PAD 65CMx65CM
2029;46000R;POLYESTER FILLER PAD 45x30cm
2030;46000S;POLYESTER FILLER PAD 40x40cm
36098;46000U;POLYESTER FILLER PAD 30CMx30CM
12841;46115B;GREEN POP ART MAO CUSHION COVER 
10638;46118;FUNKY MONKEY CUSHION COVER
126343;46126A;ELVIS WALLHANGING / CURTAIN
42128;46138B;BLUE CHENILLE SHAGGY CUSHION COVER 
2886;46775D;SUNSET COLOUR CHUNKY KNITTED THROW
11227;46776A;WOVEN BUBBLE GUM CUSHION COVER
2887;46776B;WOVEN BERRIES CUSHION COVER 
10639;46776C;WOVEN FROST CUSHION COVER
24585;46776D;WOVEN SUNSET CUSHION COVER 
10640;46776E;WOVEN CANDY CUSHION COVER 
22831;46776F;WOVEN ROSE GARDEN CUSHION COVER 
428990;46776a;WOVEN BUBBLE GUM CUSHION COVER
428991;46776b;WOVEN BERRIES CUSHION COVER 
428993;46776e;WOVEN CANDY CUSHION COVER 
428994;46776f;WOVEN ROSE GARDEN CUSHION COVER 
121768;47013A;WINE BOTTLE DRESSING LT.BLUE
131504;47013C;WINE BOTTLE DRESSING DARK BLUE
430923;47016;LIGHT DECORATION BATTERY OPERATED
5162;47021G;SET/6 BEAD COASTERS GAUZE BAG GOLD
7781;47310M;SMALL POP BOX,FUNKY MONKEY
223223;47310M;SMALL POP BOX FUNKY MONKEY
93433;47341A;FUSCHIA TABLE RUN FLOWER 
168830;47341B;BLUE TABLE RUN FLOWER
7062;47343A;FUSCHIA FLOWER PURSE WITH BEADS
125878;47344B;BLUE FLOWER DES PURSE
17364;47348A;FUSCHIA VOILE POINTY SHOE DEC
47668;47351B;BLUE  VOILE LAMPSHADE
9326;47367B;PAIR PADDED HANGERS PINK CHECK
9304;47369A;PINK GREEN EMBROIDERY COSMETIC BAG
9305;47369B;BLUE GREEN EMBROIDERY COSMETIC BAG
17873;47420;ASSORTED COLOUR SUCTION CUP HOOK
1114;47421;ASSORTED COLOUR LIZARD SUCTION HOOK
7039;47422;ASSORTED MONKEY SUCTION CUP HOOK
58968;47469;ASSORTED SHAPES PHOTO CLIP SILVER 
3532;47471;RAINBOW PEGS PHOTO CLIP STRING
11821;47480;HANGING PHOTO CLIP ROPE LADDER
13721;47481;50CM METAL STRING WITH  7 CLIPS
29641;47503A;ASS FLORAL PRINT MULTI SCREWDRIVER
7055;47503H;ASS FLORAL PRINT SPIRIT LEVEL 
6412;47503J;SET/3 FLORAL GARDEN TOOLS IN BAG
1059;47504H;ENGLISH ROSE SPIRIT LEVEL 
6441;47504K;ENGLISH ROSE GARDEN SECATEURS
46462;47518F;ICON PLACEMAT POP ART ELVIS
40479;47518f;ICON PLACEMAT POP ART ELVIS
52451;47556B;TEA TIME TEA TOWELS 
1725;47559B;TEA TIME OVEN GLOVE
6924;47559b;TEA TIME OVEN GLOVE
885;47563A;RETRO LONGBOARD IRONING BOARD COVER
5523;47566;PARTY BUNTING
2889;47566B;TEA TIME PARTY BUNTING
5426;47566b;TEA TIME PARTY BUNTING
2890;47567B;TEA TIME KITCHEN APRON
378;47570B;TEA TIME TABLE CLOTH
16088;47570b;TEA TIME TABLE CLOTH
13984;47574A;ENGLISH ROSE SCENTED HANGING FLOWER
189487;47574B;ENGLISH ROSE SCENTED HANGING HEART
22118;47578A;ENGLISH ROSE SMALL SCENTED FLOWER
8712;47579;TEA TIME BREAKFAST BASKET
126;47580;TEA TIME DES TEA COSY
36768;47585A;PINK FAIRY CAKE CUSHION COVER
12747;47586A;PINK FAIRY CAKE CUSHION COVER
45539;47589;CONGRATULATIONS BUNTING
2891;47590A;BLUE HAPPY BIRTHDAY BUNTING
2892;47590B;PINK HAPPY BIRTHDAY BUNTING
62208;47590b;PINK HAPPY BIRTHDAY BUNTING
1727;47591B;SCOTTIES CHILDRENS APRON
1728;47591D;PINK FAIRY CAKE CHILDRENS APRON
534711;47591b;SCOTTIES CHILDRENS APRON
6926;47591d;PINK FAIRY CAKE CHILDRENS APRON
25744;47593A;CAROUSEL PONIES BABY BIB
1729;47593B;SCOTTIE DOGS BABY BIB
429003;47593b;SCOTTIE DOGS BABY BIB
2896;47594A;CAROUSEL DESIGN WASHBAG
32110;47594B;SCOTTIES DESIGN WASHBAG
1017;47599A;PINK PARTY BAGS
1018;47599B;BLUE PARTY BAGS 
2105;48111;DOORMAT 3 SMILEY CATS
17980;48116;DOORMAT MULTICOLOUR STRIPE
340;48129;DOORMAT TOPIARY
1385;48138;DOORMAT UNION FLAG
853;48173C;DOORMAT BLACK FLOCK 
6927;48173c;DOORMAT BLACK FLOCK 
1384;48184;DOORMAT ENGLISH ROSE 
303;48185;DOORMAT FAIRY CAKE
20;48187;DOORMAT NEW ENGLAND
1730;48188;DOORMAT WELCOME PUPPIES
15633;48189;DOORMAT FRIENDSHIP 
455;48194;DOORMAT HEARTS
10097;51008;AFGHAN SLIPPER SOCK PAIR
2099;51014A;FEATHER PEN,HOT PINK
2095;51014C;FEATHER PEN,COAL BLACK
2096;51014L;FEATHER PEN,LIGHT PINK
429010;51014c;FEATHER PEN,COAL BLACK
9538;51020A;SUMMER FUN DESIGN SHOWER CAP
9539;51020B;STRIPY DESIGN SHOWER CAP
8546;62018;SOMBRERO 
168838;62043B;BLUE CHECK BAG W HANDLE 34X20CM
77168;62074B;ELEPHANT CLIP W SUCTION CUP
55071;62086A;PINK RETRO BIG FLOWER BAG
10648;62094B;TURQ ICE CREAM BUM BAG 
3209;62096A;PINK/YELLOW FLOWERS HANDBAG
111576;62096B;PURPLE/TURQ FLOWERS HANDBAG
168837;62097B;BLUE STRIPES SHOULDER BAG
2904;70006;LOVE HEART POCKET WARMER
909;70007;HI TEC ALPINE HAND WARMER
17462;71038;WHITE HANGING BEADS CANDLE HOLDER
103935;71050;SMALL SINGLE FLAME CANDLE HOLDER
1;71053;WHITE METAL LANTERN
479291;71053;WHITE MOROCCAN METAL LANTERN
67332;71101E;STANDING FAIRY POLE SUPPORT 
6020;71143;SILVER BOOK MARK WITH BEADS
259363;71143;ANTIQUE SILVER BOOK MARK WITH BEADS
19068;71215;METAL BASE FOR CANDLES
113;71270;PHOTO CLIP LINE
8273;71279;PINK GLASS CANDLEHOLDER
11601;71403;"PINK/WHITE ""KEEP CLEAN"" BULLET BIN"
1009;71406C;BLACK ORANGE SQUEEZER
1733;71459;HANGING JAM JAR T-LIGHT HOLDER
314717;71459;HANGING JAM JAR T-LIGHT HOLDERS
465053;71477;COLOURED GLASS STAR T-LIGHT HOLDER
2407;71477;COLOUR GLASS. STAR T-LIGHT HOLDER
27644;71495A;CD WALL TIDY BLUE OFFICE
18184;71495B;CD WALL TIDY RED FLOWERS
2907;71496A;A4 WALL TIDY BLUE OFFICE
76621;71496B;A4 WALL TIDY RED FLOWERS
86428;71510;SQUARE METAL CANDLEHOLDER BASE
166729;72024U;LILAC VOTIVE CANDLE
8661;72051S;BAG OF SILVER STONES
12082;72122;COFFEE SCENT PILLAR CANDLE
3940;72127;COLUMBIAN CANDLE ROUND 
7057;72128;COLUMBIAN CANDLE ROUND
7056;72130;COLUMBIAN CANDLE ROUND
12071;72131;COLUMBIAN CANDLE RECTANGLE
18015;72132;COLUMBIAN CUBE CANDLE
3941;72133;COLUMBIAN CANDLE RECTANGLE
2908;72134;COLUMBIAN  CUBE CANDLE 
102349;72140E;BEST DAD CANDLE LETTERS
35967;72225C;LAVENDER SCENT CAKE CANDLE
5033;72232;FENG SHUI PILLAR CANDLE
7912;72349B;SET/6 PURPLE BUTTERFLY T-LIGHTS
5427;72349b;SET/6 PURPLE BUTTERFLY T-LIGHTS
6023;72351A;SET/6 TURQUOISE BUTTERFLY T-LIGHTS
11236;72351B;SET/6 PINK  BUTTERFLY T-LIGHTS
15960;72351a;SET/6 TURQUOISE BUTTERFLY T-LIGHTS
57453;72369A;PINK CLEAR GLASS CANDLE PLATE
1734;72586;SET OF 6 HALLOWEEN GHOST T-LIGHTS
1185;72598;SET/12 TAPER CANDLES
18010;72709;IVORY SCULPTED RND CANDLE 
1377;72741;GRAND CHOCOLATECANDLE
3161;72760B;VINTAGE CREAM 3 BASKET CAKE STAND
27918;72780;BLACK SILOUETTE CANDLE PLATE
442484;72783;BLACK SIL'T SQU CANDLE PLATE 
3089;72798C;SET/4 GARDEN ROSE DINNER CANDLE
67172;72799C;PINK PILLAR CANDLE SILVER FLOCK
1735;72799E;IVORY PILLAR CANDLE SILVER FLOCK
1736;72799F;IVORY PILLAR CANDLE GOLD FLOCK
1056;72800B; 4 PURPLE FLOCK DINNER CANDLES
33563;72800C;4 PINK DINNER CANDLE SILVER FLOCK
7483;72800D;4 BLUE DINNER CANDLES SILVER FLOCK
741;72800E;4 IVORY DINNER CANDLES SILVER FLOCK
4357;72801C;4 ROSE PINK DINNER CANDLES
4358;72801D;4 SKY BLUE DINNER CANDLES
11777;72801G;4 BURGUNDY WINE DINNER CANDLES
69608;72801c;4 ROSE PINK DINNER CANDLES
30770;72801d;4 SKY BLUE DINNER CANDLES
7079;72802A;ROSE SCENT CANDLE IN JEWELLED BOX
7102;72802B;OCEAN SCENT CANDLE IN JEWELLED BOX
500;72802C;VANILLA SCENT CANDLE JEWELLED BOX
246757;72802a;ROSE SCENT CANDLE IN JEWELLED BOX
490589;72802c;VANILLA SCENT CANDLE JEWELLED BOX
3075;72803A;ROSE SCENT CANDLE JEWELLED DRAWER
5674;72803b;OCEAN SCENT CANDLE JEWELLED DRAWER
1737;72807A;SET/3 ROSE CANDLE IN JEWELLED BOX
1738;72807B;SET/3 OCEAN SCENT CANDLE JEWEL BOX
1739;72807C;SET/3 VANILLA SCENTED CANDLE IN BOX
62210;72807a;SET/3 ROSE CANDLE IN JEWELLED BOX
79236;72807b;SET/3 OCEAN SCENT CANDLE JEWEL BOX
255028;72807c;SET/3 VANILLA SCENTED CANDLE IN BOX
169964;72811;SMALL ZINC/GLASS CANDLEHOLDER
85462;72812;LARGE ZINC GLASS CANDLEHOLDER
21868;72815;3 WICK CHRISTMAS BRIAR CANDLE 
1740;72816;SET/3 CHRISTMAS DECOUPAGE CANDLES
1333;72817;SET OF 2 CHRISTMAS DECOUPAGE CANDLE
859;72818;CHRISTMAS DECOUPAGE CANDLE
13988;72819;CUPID DESIGN SCENTED CANDLES
73060;72821;CUPID SCENTED CANDLE IN GLASS
29636;75011;BLUE DAISY MOBILE
8890;75013B;STRING OF 8 BUTTERFLIES,PINK
6029;75049L;LARGE CIRCULAR MIRROR MOBILE
6030;75131;METAL TUBE CHIME ON BAMBOO
85846;75172;PAINTED SEA SHELL METAL WINDCHIME
29635;75178;ASSTD COL BUTTERFLY/CRYSTAL W/CHIME
221827;77079;DOLPHIN WINDMILL
8136;77101A;UNION FLAG WINDSOCK
124614;78033;FLAG OF ST GEORGE CHAIR
8408;78034B;BLUE NETTING STORAGE HANGER
18186;78124;MAGAZINE RACK GEBRA ASSORTED 
5285;79000;MOROCCAN TEA GLASS
109256;79026B;S/4 ICON COASTER,ELVIS LIVES
1742;79030D;TUMBLER, BAROQUE
144958;79030D;TUMBLER BAROQUE
1743;79030G;TUMBLER, NEW ENGLAND
150781;79030G;TUMBLER NEW ENGLAND
363501;79051A;SMOKEY GREY COLOUR GLASS
12258;79051A;SMOKEY GREY COLOUR D.O.F. GLASS
93357;79062D;RETRO TIN ASHTRAY,REVOLUTIONARY
114609;79063C;RETRO PILL BOX KEY CHAIN,THE KING
85710;79063D;RETRO PILL BOX , REVOLUTIONARY
2082;79066K;RETRO MOD TRAY
21757;79066k;RETRO MOD TRAY
2913;79067;CORONA MEXICAN TRAY
44233;79071B;ENGLISH ROSE METAL WASTE BIN
1995;79144B;PAINTED LIGHTBULB STAR+ MOON
15412;79144C;PAINTED LIGHTBULB RAINBOW DESIGN
8406;79149B;SILICON STAR BULB  BLUE
8410;79151B;SILICON CUBE 25W, BLUE
414951;79157B;UBO-LIGHT TRIOBASE BLUE
384589;79157V;UBO-LIGHT TRIOBASE PURPLE
11970;79160;HEART SHAPE WIRELESS DOORBELL
447168;79161A;ST GEORGE SET OF 10 PARTY LIGHTS
4290;79163;BLACK CHAMPAGNE GLASS
4283;79164;BLACK WINE GLASS
9158;79190A;RETRO PLASTIC 70'S TRAY
20305;79190B;RETRO PLASTIC POLKA TRAY
9967;79190D;RETRO PLASTIC DAISY TRAY
6032;79191B;RETRO PLASTIC POLKA TRAY
3527;79191C;RETRO PLASTIC ELEPHANT TRAY
38523;79191D;RETRO PLASTIC DAISY TRAY
64258;79192A;RETRO PLASTIC 70'S TRAY
2132;79302M;ART LIGHTS,FUNK MONKEY
44627;79320;FLAMINGO LIGHTS
178;79321;CHILLI LIGHTS
45620;79323B;BLACK CHERRY LIGHTS
50725;79323P;PINK CHERRY LIGHTS
63337;79323W;WHITE CHERRY LIGHTS
31521;79329;PINK FLOCK GLASS CANDLEHOLDER
94869;79331;PINK FLOCK GLASS CANDLEHOLDER
282450;79336;LIGHT PINK FLOCK GLASS CANDLEHOLDER
7175;79337;BLUE FLOCK GLASS CANDLEHOLDER
18310;79403;FROSTED WHITE BASE 
91436;79406;FROSTED WHITE BASE 
248185;81950B;FLOWER BLUE CLOCK WITH SUCKER
23614;81950V;FLOWER PURPLE CLOCK W/SUCKER
248184;81950V;FLOWER PURPLE CLOCK WITH SUCKER
248182;81952B;ROUND BLUE CLOCK WITH SUCKER
248183;81952V;ROUND PURPLE CLOCK WITH SUCKER
260397;81953B;ROUND BLUE CLOCK WITH SUCKER
260411;81953P;ROUND ARTICULATED PINK CLOCK W/SUCK
6033;82001S;VINYL RECORD FRAME SILVER
422039;82001S;SILVER RECORD COVER FRAME
427254;82001s;SILVER RECORD COVER FRAME
85546;82001s;VINYL RECORD FRAME SILVER
26559;82011A;BATHROOM SCALES, TROPICAL BEACH
8933;82011B;BATHROOM SCALES RUBBER DUCKS
7167;82011C;BATHROOM SCALES FOOTPRINTS IN SAND
88623;82095;HEART BUTTONS JEWELLERY BOX
59;82482;WOODEN PICTURE FRAME WHITE FINISH
57;82483;WOOD 2 DRAWER CABINET WHITE FINISH
155;82484;WOOD BLACK BOARD ANT WHITE FINISH
58;82486;WOOD S/3 CABINET ANT WHITE FINISH
313400;82486;3 DRAWER ANTIQUE WHITE WOOD CABINET
60;82494L;WOODEN FRAME ANTIQUE WHITE 
6930;82494l;WOODEN FRAME ANTIQUE WHITE 
1745;82551;LAUNDRY 15C METAL SIGN
779;82552;WASHROOM METAL SIGN
109;82567;AIRLINE LOUNGE,METAL SIGN
342;82578;KITCHEN METAL SIGN
341;82580;BATHROOM METAL SIGN
343;82581;TOILET METAL SIGN
2920;82582;AREA PATROLLED METAL SIGN
1748;82583;HOT BATHS METAL SIGN
2921;82599;FANNY'S REST STOPMETAL SIGN
382466;82600;N0 SINGING METAL SIGN
1302;82600;NO SINGING METAL SIGN
25878;82605;OLD DOC RUSSEL METAL SIGN
39353;82613A;METAL SIGN,CUPCAKE SINGLE HOOK
1749;82613B;METAL SIGN,CUPCAKE SINGLE HOOK
1750;82613C;METAL SIGN,CUPCAKE SINGLE HOOK
1751;82613D;METAL SIGN CUPCAKE SINGLE HOOK
218090;82613a;METAL SIGN,CUPCAKE SINGLE HOOK
40282;82613b;METAL SIGN,CUPCAKE SINGLE HOOK
40283;82613c;METAL SIGN,CUPCAKE SINGLE HOOK
2304;82615;PINK MARSHMALLOW SCARF KNITTING KIT
6971;82616B;FRAPPUCINO SCARF KNITTING KIT
2925;82616C;MIDNIGHT GLAMOUR SCARF KNITTING KIT
5446;84006;MAGIC TREE -PAPER FLOWERS
21064;84012;MAGIC SHEEP WOOL GROWING FROM PAPER
169755;84016;FLAG OF ST GEORGE CAR FLAG
4;84029E;RED WOOLLY HOTTIE WHITE HEART.
3;84029G;KNITTED UNION FLAG HOT WATER BOTTLE
231;84030E;ENGLISH ROSE HOT WATER BOTTLE
6933;84030e;ENGLISH ROSE HOT WATER BOTTLE
1754;84031A;CHARLIE+LOLA RED HOT WATER BOTTLE 
1755;84031B;CHARLIE LOLA BLUE HOT WATER BOTTLE 
429042;84031a;CHARLIE+LOLA RED HOT WATER BOTTLE 
429044;84031b;CHARLIE LOLA BLUE HOT WATER BOTTLE 
1756;84032A;CHARLIE+LOLA PINK HOT WATER BOTTLE
676;84032B;CHARLIE + LOLA RED HOT WATER BOTTLE
61422;84033;FLAG OF ST GEORGE 
1285;84050;PINK HEART SHAPE EGG FRYING PAN
8734;84051;ASS COLOUR GLOWING TIARAS
3249;84077;WORLD WAR 2 GLIDERS ASSTD DESIGNS
10675;84078A;SET/4 WHITE RETRO STORAGE CUBES 
114581;84086B;YELLOW/BLUE RETRO RADIO
1759;84086C;PINK/PURPLE RETRO RADIO
19839;84192;ASSORTED COLOUR METAL CAT 
39204;84199;GLOW IN DARK DOLPHINS
306954;84201B;HAPPY BIRTHDAY CARD STRIPEY TEDDY
313246;84201C;HAPPY BIRTHDAY CARD TEDDY/CAKE
306953;84206A;3 BLACK CATS W HEARTS BLANK CARD
481016;84206B;CAT WITH SUNGLASSES BLANK CARD
208032;84206C;CHAMPAGNE TRAY BLANK CARD
6447;84212;"ASSORTED FLOWER COLOUR ""LEIS"""
43407;84218;BOX/12 CHICK & EGG IN BASKET
63151;84226;HEN HOUSE W FAMILY IN BARN & NEST
118834;84227;HEN HOUSE W CHICK IN NEST
144928;84228;HEN HOUSE WITH CHICK STANDING
10676;84228;HEN HOUSE W CHICK STANDING
58575;84231;EASTER BUNNY WITH BASKET ON BACK
16122;84247E;PACK/12 XMAS FUN CARD
355998;84247E;PACK OF 12 CHRISTMAS FUN CARDS
5047;84247G;DECOUPAGE,GREETING CARD,
6424;84247K;FOLK ART GREETING CARD,pack/12
19594;84247L;FAWN AND MUSHROOM GREETING CARD
6423;84247N;PACK/12 BLUE FOLKART CARDS
37570;84249A;GREETING CARD,SQUARE, DOUGHNUTS
16564;84251B;GREETING CARD, STICKY GORDON
41950;84251C;GREETING CARD, TWO SISTERS.
18329;84251G;GREETING CARD, OVERCROWDED POOL.
6050;84270;ASSTD DESIGN BUBBLE GUM RING
77303;84279B;CHERRY BLOSSOM DECORATIVE FLASK
1760;84279P;CHERRY BLOSSOM  DECORATIVE FLASK
94950;84306;S/3 PINK SQUARE PLANTERS ROSES
13760;84313B;BLUE TV TRAY TABLE 
28552;84313C;ORANGE TV TRAY TABLE 
3763;84341B;SMALL PINK MAGIC CHRISTMAS TREE
476;84347;ROTATING SILVER ANGELS T-LIGHT HLDR
2085;84352;SILVER CHRISTMAS TREE BAUBLE STAND 
22075;84356;POMPOM CURTAIN
8144;84358;FLOOR LAMP SHADE WOOD BASE
2251;84360;TABLE LAMP WHITE SHADE WOOD BASE
447;84375;SET OF 20 KIDS COOKIE CUTTERS
404;84378;SET OF 3 HEART COOKIE CUTTERS
403;84380;SET OF 3 BUTTERFLY COOKIE CUTTERS
271839;84387A;BIRD ON BRANCH CANVAS SCREEN
14688;84388;WISE MAN STAR SHAPE EGG PAN
267848;84402B;PURPLE DRESS JEWELLERY STAND
2;84406B;CREAM CUPID HEARTS COAT HANGER
216415;84415A;PINK FLOCK SUEDE CUSHION COVER 
18091;84415B;BLUE FLOCK CUSHION COVER 
13766;84422;PINK/BLUE DISC/MIRROR STRING
13767;84429A;MEDIUM PINK BUDDHA HEAD 
82251;84452;METAL RABBIT LADDER EASTER 
37559;84457;SET/3 RABBITS FLOWER SKIPPPING ROPE
11262;84459A;PINK METAL CHICKEN HEART 
2937;84459B;YELLOW METAL CHICKEN HEART 
58606;84461;12 PINK HEN+CHICKS IN BASKET
58605;84462;3 PINK HEN+CHICKS IN BASKET
75015;84465;15 PINK FLUFFY CHICKS IN BOX
99484;84466;TOP SECRET PEN SET
16260;84497;BUTTONS AND STRIPES NOTEBOOK 
40978;84499;BLACK FLOWER CANDLE PLATE
31566;84507B;STRIPES DESIGN MONKEY DOLL
6964;84507C;BLUE CIRCLES DESIGN MONKEY DOLL
2037;84508A;CAMOUFLAGE DESIGN TEDDY
7823;84508B;STRIPES DESIGN TEDDY
8527;84508C;BLUE CIRCLES DESIGN TEDDY
330;84509A;SET OF 4 ENGLISH ROSE PLACEMATS
2143;84509B;SET OF 4 FAIRY CAKE PLACEMATS
13769;84509C;SET OF 4 POLKADOT PLACEMATS 
22868;84509E;SET OF 4 CAROUSEL PLACEMATS 
3764;84509G;SET OF 4 FAIRY CAKE PLACEMATS 
81932;84509a;SET OF 4 ENGLISH ROSE PLACEMATS
79304;84509b;SET OF 4 FAIRY CAKE PLACEMATS
5658;84509c;SET OF 4 POLKADOT PLACEMATS 
182378;84509g;SET OF 4 FAIRY CAKE PLACEMATS 
331;84510A;SET OF 4 ENGLISH ROSE COASTERS
13770;84510C;SET OF 4 POLKADOT COASTERS
22869;84510E;SET OF 4 GREEN CAROUSEL COASTERS
21875;84510a;SET OF 4 ENGLISH ROSE COASTERS
15967;84510c;SET OF 4 POLKADOT COASTERS
156801;84510e;SET OF 4 GREEN CAROUSEL COASTERS
100;84519A;TOMATO CHARLIE+LOLA COASTER SET
3964;84519B;CARROT CHARLIE+LOLA COASTER SET
2940;84520B;PACK 20 ENGLISH ROSE PAPER NAPKINS
11826;84522;PINK PARTY SUNGLASSES
67157;84527;FLAMES SUNGLASSES PINK LENSES
9886;84531A;PINK KNITTED EGG COSY
9899;84531B;BLUE KNITTED EGG COSY
1817;84534B;FAIRY CAKE NOTEBOOK A5 SIZE
5659;84534b;FAIRY CAKE NOTEBOOK A5 SIZE
116113;84535A;ENGLISH ROSE NOTEBOOK A6 SIZE
1818;84535B;FAIRY CAKES NOTEBOOK A6 SIZE
1819;84536A;ENGLISH ROSE NOTEBOOK A7 SIZE
1820;84536B;FAIRY CAKES NOTEBOOK A7 SIZE
84501;84536a;ENGLISH ROSE NOTEBOOK A7 SIZE
21766;84536b;FAIRY CAKES NOTEBOOK A7 SIZE
6360;84539;KNITTED RABBIT DOLL 
131651;84548;CROCHET BEAR RED/BLUE  KEYRING
141101;84549;CROCHET WHITE RABBIT KEYRING 
498724;84550;CROCHET LILAC/RED BEAR KEYRING
224878;84551;CROCHET DOG KEYRING
886;84558A;3D DOG PICTURE PLAYING CARDS
16097;84558a;3D DOG PICTURE PLAYING CARDS
2943;84559A;3D SHEET OF DOG STICKERS
2944;84559B;3D SHEET OF CAT STICKERS
5660;84559a;3D SHEET OF DOG STICKERS
15846;84559b;3D SHEET OF CAT STICKERS
7137;84562A;PINK/WHITE RIBBED MELAMINE JUG
1057;84563A;PINK & WHITE BREAKFAST TRAY
9131;84563B;BLUE & WHITE BREAKFAST TRAY
10687;84568;GIRLS ALPHABET IRON ON PATCHES 
12144;84569A;PACK 3 IRON ON DOG PATCHES
1120;84569B;PACK 3 FIRE ENGINE/CAR PATCHES
133231;84569C;PACK 4 FLOWER/BUTTERFLY PATCHES
8479;84569D;PACK 6 HEART/ICE-CREAM PATCHES
28533;84575A;PINK DOG CANNISTER
144876;84576;BLUE CAT BISCUIT BARREL PINK HEART
1821;84580;MOUSE TOY WITH PINK T-SHIRT
1822;84581;DOG TOY WITH PINK CROCHET SKIRT
27672;84584;PINK GINGHAM CAT WITH SCARF
64120;84592;CROCHET ROSE PURSE WITH SUEDE BACK
112198;84593;CROCHET ROSE DES CLOTHES HANGER
23423;84595E;LARGE TORTILLA DESIGN RED BOWL
11898;84596B;SMALL DOLLY MIX DESIGN ORANGE BOWL
1012;84596E;SMALL LICORICE DES PINK BOWL
9639;84596F;SMALL MARSHMALLOWS PINK BOWL
8064;84596G;SMALL CHOCOLATES PINK BOWL
2946;84596J;MIXED NUTS LIGHT GREEN BOWL
9638;84596L;BISCUITS SMALL BOWL LIGHT BLUE
15968;84596b;SMALL DOLLY MIX DESIGN ORANGE BOWL
5661;84596e;SMALL LICORICE DES PINK BOWL
92343;84596f;SMALL MARSHMALLOWS PINK BOWL
92413;84596g;SMALL CHOCOLATES PINK BOWL
203907;84596l;BISCUITS SMALL BOWL LIGHT BLUE
30067;84597B;RETRO BROWN BALL ASHTRAY 
9537;84597C;RETRO PINK BALL ASHTRAY 
1823;84598;BOYS ALPHABET IRON ON PATCHES
35393;84600;NEW BAROQUE JEWELLERY BOX 
2947;84609;TALL ROCOCO CANDLE HOLDER
32807;84613A;PINK NEW BAROQUE FLOCK CANDLESTICK
17494;84613C;BLUE NEW BAROQUE FLOCK CANDLESTICK
7193;84614A;PINK BAROQUE FLOCK CANDLE HOLDER
30347;84616;SILVER ROCCOCO CHANDELIER
49694;84617;NEW BAROQUE BLACK BOXES
31698;84620;BLUE GINGHAM ROSE CUSHION COVER
374;84625A;PINK NEW BAROQUECANDLESTICK CANDLE
373;84625C;BLUE NEW BAROQUE CANDLESTICK CANDLE
171296;84629;WHITE 3 FRAME BIRDS AND TREE 
23786;84631;FRUIT TREE AND BIRDS WALL PLAQUE
69557;84632;DECORATIVE HANGING SHELVING UNIT
11270;84637;KITCHEN FLOWER POTS WALL PLAQUE
