;StockCode;Description
165;22427;ENAMEL FLOWER JUG CREAM
166;22428;ENAMEL FIRE BUCKET CREAM
1092;22429;ENAMEL MEASURING JUG CREAM
1576;22430;ENAMEL WATERING CAN CREAM
3366;22431;WATERING CAN BLUE ELEPHANT
1577;22432;WATERING CAN PINK BUNNY
3365;22433;WATERING CAN GREEN DINOSAUR
3284;22434;BALLOON PUMP WITH 10 BALLOONS
352;22435;SET OF 9 HEART SHAPED BALLOONS
4012;22436;12 COLOURED PARTY BALLOONS
1578;22437;SET OF 9 BLACK SKULL BALLOONS
136;22438;BALLOON ART MAKE YOUR OWN FLOWERS
4276;22439;6 ROCKET BALLOONS 
3283;22440;BALLOON WATER BOMB PACK OF 35
346;22441;GROW YOUR OWN BASIL IN ENAMEL MUG
3773;22442;GROW YOUR OWN FLOWERS SET OF 3
5165;22443;GROW YOUR OWN HERBS SET OF 3
1236;22444;GROW YOUR OWN PLANT IN A CAN 
1172;22445;PENCIL CASE LIFE IS BEAUTIFUL
3041;22446;PIN CUSHION BABUSHKA PINK
3040;22447;PIN CUSHION BABUSHKA BLUE
3039;22448;PIN CUSHION BABUSHKA RED
309;22449;SILK PURSE BABUSHKA PINK
3962;22450;SILK PURSE BABUSHKA BLUE
322;22451;SILK PURSE BABUSHKA RED
4432;22452;MEASURING TAPE BABUSHKA PINK
1170;22453;MEASURING TAPE BABUSHKA BLUE
1138;22454;MEASURING TAPE BABUSHKA RED
5515;22456;NATURAL SLATE CHALKBOARD LARGE 
159;22457;NATURAL SLATE HEART CHALKBOARD 
2719;22458;CAST IRON HOOK GARDEN FORK
2720;22459;CAST IRON HOOK GARDEN TROWEL
3362;22460;EMBOSSED GLASS TEALIGHT HOLDER
9923;22461;SAVOY ART DECO CLOCK
157;22464;HANGING METAL HEART LANTERN
452;22465;HANGING METAL STAR LANTERN
181;22466;FAIRY TALE COTTAGE NIGHTLIGHT
320436;22466;FAIRY TALE COTTAGE NIGHT LIGHT
372;22467;GUMBALL COAT RACK
300;22468;BABUSHKA LIGHTS STRING OF 10
160;22469;HEART OF WICKER SMALL
161;22470;HEART OF WICKER LARGE
1584;22471;TV DINNER TRAY AIR HOSTESS 
668;22472;TV DINNER TRAY DOLLY GIRL
329;22473;TV DINNER TRAY VINTAGE PAISLEY
4125;22474;SPACEBOY TV DINNER TRAY
9564;22475;SKULL DESIGN TV DINNER TRAY
1585;22476;EMPIRE UNION JACK TV DINNER TRAY
1586;22477;WATERING CAN GARDEN MARKER
1587;22478;BIRDHOUSE GARDEN MARKER 
1588;22479;DAISY GARDEN MARKER
737;22480;RED TEA TOWEL CLASSIC DESIGN
1067;22481;BLACK TEA TOWEL CLASSIC DESIGN
2002;22482;BLUE TEA TOWEL CLASSIC DESIGN
5862;22483;RED GINGHAM TEDDY BEAR 
940;22485;SET OF 2 WOODEN MARKET CRATES
11776;22486;PLASMATRONIC LAMP
1188;22487;WHITE WOOD GARDEN PLANT LADDER
456;22488;NATURAL SLATE RECTANGLE CHALKBOARD
1253;22489;PACK OF 12 TRADITIONAL CRAYONS
3327;22491;PACK OF 12 COLOURED PENCILS
44;22492;MINI PAINT SET VINTAGE 
1412;22493;PAINT YOUR OWN CANVAS SET
1306;22494;EMERGENCY FIRST AID TIN 
10842;22495;SET OF 2 ROUND TINS CAMEMBERT 
2182;22496;SET OF 2 ROUND TINS DUTCH CHEESE
1592;22497;SET OF 2 TINS VINTAGE BATHROOM 
14295;22498;WOODEN REGATTA BUNTING
2726;22499;WOODEN UNION JACK BUNTING
846;22500;SET OF 2 TINS JARDIN DE PROVENCE
1014;22501;PICNIC BASKET WICKER LARGE
221320;22502;PICNIC BASKET WICKER 60 PIECES
249;22502;PICNIC BASKET WICKER SMALL
2728;22503;CABIN BAG VINTAGE PAISLEY
5237;22504;CABIN BAG VINTAGE RETROSPOT
3968;22505;MEMO BOARD COTTAGE DESIGN
3175;22507;MEMO BOARD RETROSPOT  DESIGN
719;22508;DOORSTOP RETROSPOT HEART
7197;22509;SEWING BOX RETROSPOT DESIGN 
17976;22510;GINGHAM BABUSHKA DOORSTOP
721;22511;RETROSPOT BABUSHKA DOORSTOP
16387;22512;DOORSTOP RACING CAR DESIGN
15933;22513;DOORSTOP FOOTBALL DESIGN
3973;22514;CHILDS GARDEN SPADE BLUE
1593;22515;CHILDS GARDEN SPADE PINK
15725;22516;CHILDS GARDEN RAKE BLUE
1594;22517;CHILDS GARDEN RAKE PINK
5618;22518;CHILDS GARDEN BRUSH BLUE
1595;22519;CHILDS GARDEN BRUSH PINK
29506;22520;CHILDS GARDEN TROWEL BLUE 
10845;22521;CHILDS GARDEN TROWEL PINK
29501;22522;CHILDS GARDEN FORK BLUE 
10846;22523;CHILDS GARDEN FORK PINK
3062;22524;CHILDRENS GARDEN GLOVES BLUE
5408;22525;CHILDRENS GARDEN GLOVES PINK
20867;22526;WHEELBARROW FOR CHILDREN 
15593;22528;GARDENERS KNEELING PAD
674;22529;MAGIC DRAWING SLATE GO TO THE FAIR 
675;22530;MAGIC DRAWING SLATE DOLLY GIRL 
503;22531;MAGIC DRAWING SLATE CIRCUS PARADE  
8398;22532;MAGIC DRAWING SLATE LEAP FROG 
436;22533;MAGIC DRAWING SLATE BAKE A CAKE 
672;22534;MAGIC DRAWING SLATE SPACEBOY 
13081;22535;MAGIC DRAWING SLATE BUNNIES 
2733;22536;MAGIC DRAWING SLATE PURDEY
435;22537;MAGIC DRAWING SLATE DINOSAUR
18735;22538;MINI JIGSAW GO TO THE FAIR
1248;22539;MINI JIGSAW DOLLY GIRL
42;22540;MINI JIGSAW CIRCUS PARADE 
18738;22541;MINI JIGSAW LEAP FROG
1246;22543;MINI JIGSAW BAKE A CAKE 
43;22544;MINI JIGSAW SPACEBOY
1600;22545;MINI JIGSAW BUNNIES
5876;22546;MINI JIGSAW PURDEY
1244;22547;MINI JIGSAW DINOSAUR 
1088;22548;HEADS AND TAILS SPORTING FUN
323;22549;PICTURE DOMINOES
1603;22550;HOLIDAY FUN LUDO
670;22551;PLASTERS IN TIN SPACEBOY
241;22553;PLASTERS IN TIN SKULLS
671;22554;PLASTERS IN TIN WOODLAND ANIMALS
1240;22555;PLASTERS IN TIN STRONGMAN
235;22556;PLASTERS IN TIN CIRCUS PARADE 
240;22557;PLASTERS IN TIN VINTAGE PAISLEY 
260;22558;CLOTHES PEGS RETROSPOT PACK 24 
3584;22559;SEASIDE FLYING DISC
1607;22560;TRADITIONAL MODELLING CLAY
1252;22561;WOODEN SCHOOL COLOURING SET
4619;22562;MONSTERS STENCIL CRAFT
7639;22563;HAPPY STENCIL CRAFT
3286;22564;ALPHABET STENCIL CRAFT
667;22565;FELTCRAFT HAIRBANDS PINK AND WHITE 
666;22566;FELTCRAFT HAIRBAND PINK AND PURPLE
1298;22567;20 DOLLY PEGS RETROSPOT
490;22568;FELTCRAFT CUSHION OWL
597;22569;FELTCRAFT CUSHION BUTTERFLY
596;22570;FELTCRAFT CUSHION RABBIT
874;22571;ROCKING HORSE RED CHRISTMAS 
2199;22572;ROCKING HORSE GREEN CHRISTMAS 
818;22573;STAR WOODEN CHRISTMAS DECORATION
1372;22574;HEART WOODEN CHRISTMAS DECORATION
979;22575;METAL MERRY CHRISTMAS WREATH
2211;22576;SWALLOW WOODEN CHRISTMAS DECORATION
819;22577;WOODEN HEART CHRISTMAS SCANDINAVIAN
2272;22578;WOODEN STAR CHRISTMAS SCANDINAVIAN
2198;22579;WOODEN TREE CHRISTMAS SCANDINAVIAN
632;22580;ADVENT CALENDAR GINGHAM SACK
2196;22581;WOOD STOCKING CHRISTMAS SCANDISPOT
835;22582;PACK OF 6 SWEETIE GIFT BOXES
988;22583;PACK OF 6 HANDBAG GIFT BOXES
1132;22584;PACK OF 6 PANNETONE GIFT BOXES
464457;22584;PACK OF 6 PANETTONE GIFT BOXES
711;22585;PACK OF 6 BIRDY GIFT TAGS
2752;22586;FELTCRAFT HAIRBAND PINK AND BLUE
665;22587;FELTCRAFT HAIRBAND RED AND BLUE
948;22588;CARD HOLDER GINGHAM HEART
1616;22589;CARDHOLDER GINGHAM STAR
5222;22591;CARDHOLDER GINGHAM CHRISTMAS TREE
2084;22592;CARDHOLDER HOLLY WREATH METAL
644;22593;CHRISTMAS GINGHAM STAR
643;22594;CHRISTMAS GINGHAM TREE
72285;22595;GINGHAM HEART DECORATION
645;22595;CHRISTMAS GINGHAM HEART
73076;22596;CHRISTMAS STAR WISH LIST CHALKBOARD
2021;22597;CHRISTMAS MUSICAL ZINC HEART 
69786;22597;MUSICAL ZINC HEART DECORATION 
8318;22598;CHRISTMAS MUSICAL ZINC TREE
2020;22599;CHRISTMAS MUSICAL ZINC STAR
1371;22600;CHRISTMAS RETROSPOT STAR WOOD
1369;22601;CHRISTMAS RETROSPOT ANGEL WOOD
2758;22602;CHRISTMAS RETROSPOT HEART WOOD
72973;22602;RETROSPOT WOODEN HEART DECORATION
820;22603;CHRISTMAS RETROSPOT TREE WOOD
962;22604;SET OF 4 NAPKIN CHARMS CUTLERY
1621;22605;WOODEN CROQUET GARDEN SET
11505;22606;WOODEN SKITTLES GARDEN SET
1175;22607;WOODEN ROUNDERS GARDEN SET 
15263;22608;PENS ASSORTED FUNKY JEWELED 
5903;22609;PENS ASSORTED SPACEBALL
462;22610;PENS ASSORTED FUNNY FACE
16420;22611;VINTAGE UNION JACK SHOPPING BAG
10521;22613;PACK OF 20 SPACEBOY NAPKINS
1269;22614;PACK OF 12 SPACEBOY TISSUES
1267;22615;PACK OF 12 CIRCUS PARADE TISSUES 
648;22616;PACK OF 12 LONDON TISSUES 
3101;22617;BAKING SET SPACEBOY DESIGN
759;22618;COOKING SET RETROSPOT
243;22619;SET OF 6 SOLDIER SKITTLES
480;22620;4 TRADITIONAL SPINNING TOPS
5271;22621;TRADITIONAL KNITTING NANCY
16;22622;BOX OF VINTAGE ALPHABET BLOCKS
15;22623;BOX OF VINTAGE JIGSAW BLOCKS 
1103;22624;IVORY KITCHEN SCALES
1102;22625;RED KITCHEN SCALES
1101;22626;BLACK KITCHEN SCALES
1187;22627;MINT KITCHEN SCALES
5622;22628;PICNIC BOXES SET OF 3 RETROSPOT 
35;22629;SPACEBOY LUNCH BOX 
549;22630;DOLLY GIRL LUNCH BOX
37;22631;CIRCUS PARADE LUNCH BOX 
8;22632;HAND WARMER RED POLKA DOT
257;22632;HAND WARMER RED RETROSPOT
7;22633;HAND WARMER UNION JACK
1177;22634;CHILDS BREAKFAST SET SPACEBOY 
1176;22635;CHILDS BREAKFAST SET DOLLY GIRL 
4655;22636;CHILDS BREAKFAST SET CIRCUS PARADE
115;22637;PIGGY BANK RETROSPOT 
2209;22638;SET OF 4 NAPKIN CHARMS CROWNS 
1629;22639;SET OF 4 NAPKIN CHARMS HEARTS
2207;22640;SET OF 4 NAPKIN CHARMS 3 KEYS 
2208;22641;SET OF 4 NAPKIN CHARMS INSTRUMENT
961;22642;SET OF 4 NAPKIN CHARMS STARS   
960;22643;SET OF 4 NAPKIN CHARMS LEAVES   
129;22644;CERAMIC CHERRY CAKE MONEY BANK
717;22645;CERAMIC HEART FAIRY CAKE MONEY BANK
134;22646;CERAMIC STRAWBERRY CAKE MONEY BANK
18782;22647;CERAMIC LOVE HEART MONEY BANK
2769;22649;STRAWBERRY FAIRY CAKE TEAPOT
718;22650;CERAMIC PIRATE CHEST MONEY BANK
894;22651;GENTLEMAN SHIRT REPAIR KIT 
263;22652;TRAVEL SEWING KIT
966;22653;BUTTON BOX 
228;22654;DELUXE SEWING KIT 
4977;22655;VINTAGE RED KITCHEN CABINET
28717;22656;VINTAGE BLUE KITCHEN CABINET
36;22659;LUNCH BOX I LOVE LONDON
2238;22660;DOORMAT I LOVE LONDON
38;22661;CHARLOTTE BAG DOLLY GIRL DESIGN
174;22662;LUNCH BAG DOLLY GIRL DESIGN
171;22663;JUMBO BAG DOLLY GIRL DESIGN
492;22664;TOY TIDY DOLLY GIRL DESIGN
1296;22665;RECIPE BOX BLUE SKETCHBOOK DESIGN
1295;22666;RECIPE BOX PANTRY YELLOW DESIGN
1294;22667;RECIPE BOX RETROSPOT 
2776;22668;PINK BABY BUNTING
1639;22669;RED BABY BUNTING 
765;22670;FRENCH WC SIGN BLUE METAL
7358;22671;FRENCH LAUNDRY SIGN BLUE METAL
3382;22672;FRENCH BATHROOM SIGN BLUE METAL
2778;22673;FRENCH GARDEN SIGN BLUE METAL
8628;22674;FRENCH TOILET SIGN BLUE METAL
1640;22675;FRENCH KITCHEN SIGN BLUE METAL
3377;22676;FRENCH BLUE METAL DOOR SIGN 1
10906;22677;FRENCH BLUE METAL DOOR SIGN 2
2058;22678;FRENCH BLUE METAL DOOR SIGN 3
16071;22679;FRENCH BLUE METAL DOOR SIGN 4
1311;22680;FRENCH BLUE METAL DOOR SIGN 5
12550;22681;FRENCH BLUE METAL DOOR SIGN 6
10907;22682;FRENCH BLUE METAL DOOR SIGN 7
11624;22683;FRENCH BLUE METAL DOOR SIGN 8
8926;22684;FRENCH BLUE METAL DOOR SIGN 9
11626;22685;FRENCH BLUE METAL DOOR SIGN 0
2059;22686;FRENCH BLUE METAL DOOR SIGN No
122399;22687;DOORMAT CHRISTMAS VILLAGE
1233;22688;DOORMAT PEACE ON EARTH BLUE
5221;22689;DOORMAT MERRY CHRISTMAS RED 
9928;22690;DOORMAT HOME SWEET HOME BLUE 
11665;22691;DOORMAT WELCOME SUNRISE
2780;22692;DOORMAT WELCOME TO OUR HOME
13959;22693;GROW A FLYTRAP OR SUNFLOWER IN TIN
637;22694;WICKER STAR 
630;22695;WICKER WREATH SMALL
2249;22696;WICKER WREATH LARGE
1085;22697;GREEN REGENCY TEACUP AND SAUCER
19788;22698;PINK REGENCY TEACUP AND SAUCER
1076;22699;ROSES REGENCY TEACUP AND SAUCER 
12424;22700;BLACK AND WHITE DOG BOWL
7161;22701;PINK DOG BOWL
5697;22702;BLACK AND WHITE CAT BOWL
19480;22703;PINK CAT BOWL
1215;22704;WRAP RED APPLES 
4336;22705;WRAP GREEN PEARS 
464;22706;WRAP COWBOYS  
37461;22707;WRAP MONSTER FUN 
17078;22708;WRAP DOLLY GIRL
44407;22709;WRAP WEDDING DAY
17153;22710;WRAP I LOVE LONDON 
29377;22711;WRAP CIRCUS PARADE
920;22712;CARD DOLLY GIRL 
895;22713;CARD I LOVE LONDON 
474;22714;CARD BIRTHDAY COWBOY
10913;22715;CARD WEDDING DAY
463;22716;CARD CIRCUS PARADE
3342;22717;CARD DOG AND BALL 
3341;22718;CARD CAT AND TREE 
139;22719;GUMBALL MONOCHROME COAT RACK
28530;22720;SET OF 3 CAKE TINS PANTRY DESIGN 
29253;22721;SET OF 3 CAKE TINS SKETCHBOOK
28529;22722;SET OF 6 SPICE TINS PANTRY DESIGN
28528;22723;SET OF 6 HERB TINS SKETCHBOOK
2361;22725;ALARM CLOCK BAKELIKE CHOCOLATE
28;22726;ALARM CLOCK BAKELIKE GREEN
27;22727;ALARM CLOCK BAKELIKE RED 
26;22728;ALARM CLOCK BAKELIKE PINK
273;22729;ALARM CLOCK BAKELIKE ORANGE
271;22730;ALARM CLOCK BAKELIKE IVORY
829;22731;3D CHRISTMAS STAMPS STICKERS 
6403;22732;3D VINTAGE CHRISTMAS STICKERS 
3567;22733;3D TRADITIONAL CHRISTMAS STICKERS
1650;22734;SET OF 6 RIBBONS VINTAGE CHRISTMAS
810;22735;RIBBON REEL SOCKS AND MITTENS
478;22736;RIBBON REEL MAKING SNOWMEN 
792;22737;RIBBON REEL CHRISTMAS PRESENT 
625;22738;RIBBON REEL SNOWY VILLAGE
624;22739;RIBBON REEL CHRISTMAS SOCK BAUBLE
1309;22740;POLKADOT PEN
1655;22741;FUNKY DIVA PEN
847;22742;MAKE YOUR OWN PLAYTIME CARD KIT
1160;22743;MAKE YOUR OWN FLOWERPOWER CARD KIT
794;22744;MAKE YOUR OWN MONSOON CARD KIT
10;22745;POPPY'S PLAYHOUSE BEDROOM 
2796;22746;POPPY'S PLAYHOUSE LIVINGROOM 
2797;22747;POPPY'S PLAYHOUSE BATHROOM
11;22748;POPPY'S PLAYHOUSE KITCHEN
12;22749;FELTCRAFT PRINCESS CHARLOTTE DOLL
647;22750;FELTCRAFT PRINCESS LOLA DOLL
590;22751;FELTCRAFT PRINCESS OLIVIA DOLL
5;22752;SET 7 BABUSHKA NESTING BOXES
2081;22753;SMALL YELLOW BABUSHKA NOTEBOOK 
969;22754;SMALL RED BABUSHKA NOTEBOOK 
1659;22755;SMALL PURPLE BABUSHKA NOTEBOOK 
2802;22756;LARGE YELLOW BABUSHKA NOTEBOOK 
1660;22757;LARGE RED BABUSHKA NOTEBOOK 
1661;22758;LARGE PURPLE BABUSHKA NOTEBOOK  
559;22759;SET OF 3 NOTEBOOKS IN PARCEL
955;22760;TRAY, BREAKFAST IN BED
3681;22761;CHEST 7 DRAWER MA CAMPAGNE
5946;22762;CUPBOARD 3 DRAWER MA CAMPAGNE
4943;22763;KEY CABINET MA CAMPAGNE
69826;22764;RUSTIC WOODEN CABINET, GLASS DOORS
2191;22765;NEWSPAPER STAND
321;22766;PHOTO FRAME CORNICE
332;22767;TRIPLE PHOTO FRAME CORNICE 
333;22768;FAMILY PHOTO FRAME CORNICE
1664;22769;CHALKBOARD KITCHEN ORGANISER
9121;22770;MIRROR CORNICE
112;22771;CLEAR DRAWER KNOB ACRYLIC EDWARDIAN
389;22772;PINK DRAWER KNOB ACRYLIC EDWARDIAN
390;22773;GREEN DRAWER KNOB ACRYLIC EDWARDIAN
111;22774;RED DRAWER KNOB ACRYLIC EDWARDIAN
649;22775;PURPLE DRAWERKNOB ACRYLIC EDWARDIAN
3404;22776;CAKESTAND, 3 TIER, LOVEHEART
1029;22776;SWEETHEART CAKESTAND 3 TIER
318723;22776;SWEETHEART 3 TIER CAKE STAND 
4776;22777;GLASS CLOCHE LARGE
3406;22777;GLASS BELL JAR LARGE
138;22778;GLASS CLOCHE SMALL
3405;22778;GLASS BELL JAR SMALL
180;22779;WOODEN OWLS LIGHT GARLAND 
179;22780;LIGHT GARLAND BUTTERFILES PINK
1344;22781;GUMBALL MAGAZINE RACK
28725;22782;SET 3 WICKER STORAGE BASKETS 
153;22783;SET 3 WICKER OVAL BASKETS W LIDS
932;22784;LANTERN CREAM GAZEBO 
486;22785;SQUARECUSHION COVER PINK UNION FLAG
157504;22785;SQUARECUSHION COVER PINK UNION JACK
2051;22786;CUSHION COVER PINK UNION JACK
2807;22788;BROCANTE COAT RACK
15319;22789;T-LIGHT HOLDER SWEETHEART HANGING
1352;22791;T-LIGHT GLASS FLUTED ANTIQUE
1666;22792;FLUTED ANTIQUE CANDLE HOLDER
2083;22794;SWEETHEART WIRE MAGAZINE RACK
2090;22795;SWEETHEART RECIPE BOOK STAND
3565;22796;PHOTO FRAME 3 CLASSIC HANGING
1312;22797;CHEST OF DRAWERS GINGHAM HEART 
148;22798;ANTIQUE GLASS DRESSING TABLE POT
7685;22799;SWEETHEART WIRE FRUIT BOWL
1342;22800;ANTIQUE TALL SWIRLGLASS TRINKET POT
1343;22801;ANTIQUE GLASS PEDESTAL BOWL
2093;22802;FAUX FUR CHOCOLATE THROW
294;22803;IVORY EMBROIDERED QUILT 
365;22804;CANDLEHOLDER PINK HANGING HEART
394483;22804;PINK HANGING HEART T-LIGHT HOLDER
391;22805;BLUE DRAWER KNOB ACRYLIC EDWARDIAN
3910;22806;SET OF 6 T-LIGHTS WEDDING CAKE 
680;22807;SET OF 6 T-LIGHTS TOADSTOOLS
9072;22808;SET OF 6 T-LIGHTS EASTER CHICKS
351;22809;SET OF 6 T-LIGHTS SANTA
350;22810;SET OF 6 T-LIGHTS SNOWMEN
5957;22811;SET OF 6 T-LIGHTS CACTI 
475;22812;PACK 3 BOXES CHRISTMAS PANNETONE
463352;22812;PACK 3 BOXES CHRISTMAS PANETTONE
464515;22813;PACK 3 BOXES BIRD PANETTONE 
442;22813;PACK 3 BOXES BIRD PANNETONE 
1254;22814;CARD PARTY GAMES 
1123;22815;CARD PSYCHEDELIC APPLES
1670;22816;CARD MOTORBIKE SANTA
9476;22817;CARD SUKI BIRTHDAY
1671;22818;CARD CHRISTMAS VILLAGE
1213;22819;BIRTHDAY CARD, RETRO SPOT
19119;22820;GIFT BAG BIRTHDAY
4323;22821;GIFT BAG PSYCHEDELIC APPLES
1672;22822;CREAM WALL PLANTER HEART SHAPED
39537;22823;CHEST NATURAL WOOD 20 DRAWERS
21402;22824;3 TIER SWEETHEART GARDEN SHELF
1310;22825;DECORATIVE PLANT POT WITH FRIEZE
24985;22826;LOVE SEAT ANTIQUE WHITE METAL
246;22827;RUSTIC  SEVENTEEN DRAWER SIDEBOARD
19301;22828;REGENCY MIRROR WITH SHUTTERS
725;22829;SWEETHEART WIRE WALL TIDY
8903;22830;UTILTY CABINET WITH HOOKS
2820;22831;WHITE BROCANTE SOAP DISH
3481;22832;BROCANTE SHELF WITH HOOKS
9924;22833;HALL CABINET WITH 3 DRAWERS
660;22834;HAND WARMER BABUSHKA DESIGN
311;22835;HOT WATER BOTTLE I AM SO POORLY
384;22837;HOT WATER BOTTLE BABUSHKA 
37698;22837;HOT WATER BOTTLE BABUSHKA LARGE
152;22838;3 TIER CAKE TIN RED AND CREAM
151;22839;3 TIER CAKE TIN GREEN AND CREAM
3515;22840;ROUND CAKE TIN VINTAGE RED
2824;22841;ROUND CAKE TIN VINTAGE GREEN
1305;22842;BISCUIT TIN VINTAGE RED
9242;22843;BISCUIT TIN VINTAGE GREEN
1675;22844;VINTAGE CREAM DOG FOOD CONTAINER
1842;22845;VINTAGE CREAM CAT FOOD CONTAINER
2108;22846;BREAD BIN DINER STYLE RED 
9734;22847;BREAD BIN, DINER STYLE, IVORY
1676;22847;BREAD BIN DINER STYLE IVORY
376;22848;BREAD BIN DINER STYLE PINK
9733;22849;BREAD BIN, DINER STYLE, MINT
3925;22849;BREAD BIN DINER STYLE MINT
348;22851;SET 20 NAPKINS FAIRY CAKES DESIGN 
24987;22852;DOG BOWL VINTAGE CREAM
7468;22853;CAT BOWL VINTAGE CREAM
1015;22854;CREAM SWEETHEART EGG HOLDER
2284;22855;FINE WICKER HEART 
22400;22856;ASSORTED EASTER DECORATIONS  BELLS
25567;22857;ASSORTED EASTER GIFT TAGS
25576;22858;EASTER TIN KEEPSAKE
9028;22859;EASTER TIN BUNNY BOUQUET
9029;22860;EASTER TIN CHICKS PINK DAISY
25578;22861;EASTER TIN CHICKS IN GARDEN
1677;22862;LOVE HEART NAPKIN BOX 
2829;22863;SOAP DISH BROCANTE
256;22865;HAND WARMER OWL DESIGN
255;22866;HAND WARMER SCOTTY DOG DESIGN
276;22867;HAND WARMER BIRD DESIGN
31962;22868;NUMBER TILE COTTAGE GARDEN 0 
4893;22869;NUMBER TILE COTTAGE GARDEN 1
2833;22870;NUMBER TILE COTTAGE GARDEN 2
31979;22871;NUMBER TILE COTTAGE GARDEN 3 
31976;22872;NUMBER TILE COTTAGE GARDEN 4
16493;22873;NUMBER TILE COTTAGE GARDEN 5
31972;22874;NUMBER TILE COTTAGE GARDEN 6
16080;22875;NUMBER TILE COTTAGE GARDEN 7
1681;22876;NUMBER TILE COTTAGE GARDEN 8
4892;22877;NUMBER TILE COTTAGE GARDEN 9
4894;22878;NUMBER TILE COTTAGE GARDEN No
29655;22879;NUMBER TILE VINTAGE FONT 0
15342;22880;NUMBER TILE VINTAGE FONT 1
29653;22881;NUMBER TILE VINTAGE FONT 2
5971;22882;NUMBER TILE VINTAGE FONT 3
15343;22883;NUMBER TILE VINTAGE FONT 4
5972;22884;NUMBER TILE VINTAGE FONT 5
21979;22885;NUMBER TILE VINTAGE FONT 6 
29648;22886;NUMBER TILE VINTAGE FONT 7
26937;22887;NUMBER TILE VINTAGE FONT 8
29646;22888;NUMBER TILE VINTAGE FONT 9 
15344;22889;NUMBER TILE VINTAGE FONT No 
2834;22890;NOVELTY BISCUITS CAKE STAND 3 TIER
5521;22891;TEA FOR ONE POLKADOT
1972;22892;SET OF SALT AND PEPPER TOADSTOOLS
3911;22893;MINI CAKE STAND T-LIGHT HOLDER
8409;22894;TABLECLOTH RED APPLES DESIGN 
927;22895;SET OF 2 TEA TOWELS APPLE AND PEARS
3587;22896;PEG BAG APPLES DESIGN
57779;22896;PEG BAG APPLE DESIGN
2836;22897;OVEN MITT APPLES DESIGN
2837;22898;CHILDRENS APRON APPLES DESIGN
650;22899;CHILDREN'S APRON DOLLY GIRL 
209741;22900;SET 2 TEA TOWELS I LOVE LONDON 
40;22900; SET 2 TEA TOWELS I LOVE LONDON 
603;22902;TOTE BAG I LOVE LONDON
14766;22903;CALENDAR FAMILY FAVOURITES
990;22904;CALENDAR PAPER CUT DESIGN
991;22905;CALENDAR IN SEASON DESIGN
968;22906;12 MESSAGE CARDS WITH ENVELOPES
1025;22907;PACK OF 20 NAPKINS PANTRY DESIGN
5979;22908;PACK OF 20 NAPKINS RED APPLES
627;22909;SET OF 20 VINTAGE CHRISTMAS NAPKINS
218;22910;PAPER CHAIN KIT VINTAGE CHRISTMAS
1161;22911;PAPER CHAIN KIT LONDON
23;22912;YELLOW COAT RACK PARIS FASHION
22;22913;RED COAT RACK PARIS FASHION
24;22914;BLUE COAT RACK PARIS FASHION
190;22915;ASSORTED BOTTLE TOP  MAGNETS 
977;22916;HERB MARKER THYME
973;22917;HERB MARKER ROSEMARY
976;22918;HERB MARKER PARSLEY
972;22919;HERB MARKER MINT
974;22920;HERB MARKER BASIL
975;22921;HERB MARKER CHIVES 
191;22922;FRIDGE MAGNETS US DINER ASSORTED
193;22923;FRIDGE MAGNETS LES ENFANTS ASSORTED
3464;22924;FRIDGE MAGNETS LA VIE EN ROSE
772;22925;BLUE GIANT GARDEN THERMOMETER
150;22926;IVORY GIANT GARDEN THERMOMETER
770;22927;GREEN GIANT GARDEN THERMOMETER
1693;22928;YELLOW GIANT GARDEN THERMOMETER
34505;22929;SCHOOL DESK AND CHAIR 
17130;22930;BAKING MOULD HEART MILK CHOCOLATE
17131;22931;BAKING MOULD HEART WHITE CHOCOLATE
17132;22932;BAKING MOULD TOFFEE CUP CHOCOLATE
29214;22932;BAKING MOULD TOFFEE CUP  CHOCOLATE
19993;22933;BAKING MOULD EASTER EGG MILK CHOC
22402;22934;BAKING MOULD EASTER EGG WHITE CHOC
17174;22935;BAKING MOULD ROSE MILK CHOCOLATE
17173;22936;BAKING MOULD ROSE WHITE CHOCOLATE
17133;22937;BAKING MOULD CHOCOLATE CUPCAKES
19646;22937;BAKING MOULD CHOCOLATE CUP CAKES
29217;22937;BAKING MOULD CUPCAKE CHOCOLATE
683;22938;CUPCAKE LACE PAPER SET 6
8242;22939;APRON APPLE DELIGHT
289507;22939;ADULT APRON APPLE DELIGHT
557;22940;FELTCRAFT CHRISTMAS FAIRY
197;22941;CHRISTMAS LIGHTS 10 REINDEER
652;22942;CHRISTMAS LIGHTS 10 SANTAS 
1070;22943;CHRISTMAS LIGHTS 10 VINTAGE BAUBLES
2852;22944;CHRISTMAS METAL POSTCARD WITH BELLS
812;22945;CHRISTMAS METAL TAGS ASSORTED 
2226;22946;WOODEN ADVENT CALENDAR CREAM
1181;22947;WOODEN ADVENT CALENDAR RED
1696;22948;METAL DECORATION NAUGHTY CHILDREN 
1697;22949;36 DOILIES DOLLY GIRL
415593;22949;SET OF 36 DOLLY GIRL PAPER DOILIES
217441;22950;36 DOILIES VINTAGE CHRISTMAS
415393;22950;SET OF 36 VINTAGE CHRISTMAS DOILIES
658;22951;60 CAKE CASES DOLLY GIRL DESIGN
11426;22952;72 CAKE CASES VINTAGE CHRISTMAS
622;22952;60 CAKE CASES VINTAGE CHRISTMAS
37700;22953;BIRTHDAY BANNER TAPE
2036;22953;BIRTHDAY PARTY CORDON BARRIER TAPE
28003;22954;HEN PARTY CORDON BARRIER TAPE
985;22955;36 FOIL STAR CAKE CASES 
833;22956;36 FOIL HEART CAKE CASES
57777;22957;SET 3 PAPER VINTAGE CHICK PAPER EGG
6337;22959;WRAP CHRISTMAS VILLAGE
21;22960;JAM MAKING SET WITH JARS
105;22961;JAM MAKING SET PRINTED
214;22962;JAM JAR WITH PINK LID
29725;22963;JAM JAR WITH BLUE LID
215;22963;JAM JAR WITH GREEN LID
405;22964;3 PIECE SPACEBOY COOKIE CUTTER SET
2331;22965;3 TRADITIONAL COOKIE CUTTERS  SET
3295;22965;3 TRADITIONAl BISCUIT CUTTERS  SET
1280;22966;GINGERBREAD MAN COOKIE CUTTER
57776;22967;SET 3 SONG BIRD PAPER EGGS ASSORTED
216;22968;ROSE COTTAGE KEEPSAKE BOX 
192;22969;HOMEMADE JAM SCENTED CANDLES
32233;22970;LONDON BUS COFFEE MUG
32525;22971;QUEENS GUARD COFFEE MUG
2334;22972;CHILDRENS SPACEBOY MUG
488;22972;CHILDREN'S SPACEBOY MUG
1119;22973;CHILDREN'S CIRCUS PARADE MUG
1153;22974;CHILDRENS DOLLY GIRL MUG
487;22975;SPACEBOY CHILDRENS EGG CUP
1710;22976;CIRCUS PARADE CHILDRENS EGG CUP 
2867;22977;DOLLY GIRL CHILDRENS EGG CUP
93161;22978;PANTRY ROLLING PIN
106161;22979;PANTRY WASHING UP BRUSH
91507;22980;PANTRY SCRUBBING BRUSH
108031;22981;PANTRY APPLE CORER
106554;22982;PANTRY PASTRY BRUSH
921;22983;CARD BILLBOARD FONT
9742;22984;CARD GINGHAM ROSE 
132453;22985;WRAP BILLBOARD FONTS DESIGN
4321;22985;WRAP, BILLBOARD FONTS DESIGN
214477;22986;WRAP GINGHAM ROSE 
4009;22986;GINGHAM ROSE WRAP
171650;22987;WRAP SUMMER ROSE DESIGN
619;22988;SOLDIERS EGG CUP 
81077;22989;SET 2 PANTRY DESIGN TEA TOWELS
82536;22990;COTTON APRON PANTRY DESIGN
92678;22991;GIRAFFE WOODEN RULER
92679;22992;REVOLVER WOODEN RULER 
91748;22993;SET OF 4 PANTRY JELLY MOULDS
91972;22994;TRAVEL CARD WALLET RETROSPOT
93064;22995;TRAVEL CARD WALLET SUKI
93065;22996;TRAVEL CARD WALLET VINTAGE TICKET
93201;22997;TRAVEL CARD WALLET UNION JACK
91973;22998;TRAVEL CARD WALLET KEEP CALM
93062;22999;TRAVEL CARD WALLET RETRO PETALS
241017;22999;TRAVEL CARD WALLET VINTAGE LEAF
91971;23000;TRAVEL CARD WALLET TRANSPORT
91969;23002;TRAVEL CARD WALLET SKULLS
91970;23003;TRAVEL CARD WALLET VINTAGE ROSE 
91968;23004;TRAVEL CARD WALLET PANTRY
93202;23005;TRAVEL CARD WALLET I LOVE LONDON
91967;23006;TRAVEL CARD WALLET FLOWER MEADOW
114627;23007; SPACEBOY BABY GIFT SET
114939;23008;DOLLY GIRL BABY GIFT SET
114932;23009;I LOVE LONDON BABY GIFT SET
114626;23010;CIRCUS PARADE BABY GIFT SET
224841;23012;GLASS APOTHECARY BOTTLE PERFUME
225036;23013;GLASS APOTHECARY BOTTLE TONIC
224842;23014;GLASS APOTHECARY BOTTLE ELIXIR
307855;23015;CORDIAL JUG
229100;23015;CORDIAL GLASS JUG
228610;23016;GLASS TWIST BON BON JAR
239020;23017;APOTHECARY MEASURING JAR
239027;23018;LARGE APOTHECARY MEASURING JAR 
233653;23019;SMALL APOTHECARY MEASURING JAR 
240563;23020;GLASS SONGBIRD STORAGE JAR
224969;23020;GLASS  SONGBIRD STORAGE JAR
231205;23021;GLASS BONNE JAM JAR
227045;23022;SMALL BONNE JAM JAR  T-LIGHT HOLDER
232948;23023;RIDGED BONNE JAM JAR T-LIGHT HOLDER
235372;23024;LARGE BONNE JAM JAR  T-LIGHT HOLDER
239355;23025;DRAWER KNOB VINTAGE GLASS BALL
228675;23026;DRAWER KNOB VINTAGE GLASS STAR
235249;23027;DRAWER KNOB VINTAGE GLASS HEXAGON
224988;23028;DRAWER KNOB CRACKLE GLAZE BLUE
227041;23028;DOORKNOB CRACKED GLAZE BLUE
224990;23029;DRAWER KNOB CRACKLE GLAZE GREEN
239330;23029;DOORKNOB CRACKED GLAZE GREEN
224989;23031;DRAWER KNOB CRACKLE GLAZE PINK
239329;23031;DOORKNOB CRACKED GLAZE PINK
224987;23032;DRAWER KNOB CRACKLE GLAZE IVORY
227040;23032;DOORKNOB CRACKED GLAZE IVORY
224991;23033;DRAWER KNOB CERAMIC RED
224992;23034;DRAWER KNOB CERAMIC BLACK
224847;23035;DRAWER KNOB CERAMIC IVORY
278996;23035;DOORKNOB CERAMIC IVORY
234776;23036;T-LIGHT HOLDER SILVER PETIT FOUR 
237852;23037;CANDLE HOLDER SILVER MADELINE
257453;23038;T-LIGHT HOLDER SILVER SAUCER
229864;23039;T-LIGHT HOLDER SILVER HEART HANDLE
170328;23040;PAPER LANTERN 9 POINT SNOW STAR 
175754;23040;PAPER LANTERN 9 POINT SNOW STAR
175758;23041;PAPER LANTERN 6 POINT SNOW STAR
170327;23041;PAPER LANTERN 9 POINT SNOW STAR
170326;23042;PAPER LANTERN 7 POINT SNOW STAR
178085;23043;PAPER LANTERN 9 POINT HOLLY STAR L
175755;23043;PAPER LANTERN 9 POINT HOLLY STAR 40
178088;23044;PAPER LANTERN 9 POINT HOLLY STAR S
178272;23044;PAPER LANTERN 9 POINT HOLLY STAR 23
175756;23045;PAPER LANTERN 5 POINT STAR MOON 30
210016;23045;PAPER LANTERN 5 POINT STAR MOON 
178086;23046;PAPER LANTERN 9 POINT DELUXE STAR
178087;23047;PAPER LANTERN 5 POINT SEQUIN STAR
178275;23047;PAPER LANTERN 5 POINT STUDDED STAR
170325;23048;SET OF 10 LANTERNS FAIRY LIGHT STAR
109071;23049;RECYCLED ACAPULCO MAT RED
109074;23050;RECYCLED ACAPULCO MAT GREEN
109076;23051;RECYCLED ACAPULCO MAT BLUE
109075;23052;RECYCLED ACAPULCO MAT TURQUOISE
109072;23053;RECYCLED ACAPULCO MAT PINK
109073;23054;RECYCLED ACAPULCO MAT LAVENDER
162987;23055;IVORY CHANDELIER T-LIGHT HOLDER
184250;23056;CRYSTAL CHANDELIER T-LIGHT HOLDER
162988;23056;FLOWERS CHANDELIER T-LIGHT HOLDER
158858;23057;GEMSTONE CHANDELIER T-LIGHT HOLDER
159559;23057;BEADED CHANDELIER T-LIGHT HOLDER
338450;23058;CHRISTMAS HANGING SNOWFLAKE
158797;23060;HEART BEADED TRELLIS DECORATION
162813;23061;VINTAGE EMBOSSED HEART
184095;23061;VINTAGE ENGRAVED HEART
170384;23064;CINDERELLA CHANDELIER 
157593;23065;LARGE DECO JEWELLERY STAND
185911;23065;LARGE JEWELLERY STAND
160672;23066;SMALL DECO JEWELLERY STAND
185912;23066;SMALL JEWELLERY STAND
168206;23067;HANGING ENGRAVED METAL HEART
160683;23068;ALUMINIUM STAMPED HEART
184249;23068;ALUMINIUM HEART
