;StockCode;Description
31;10002;INFLATABLE POLITICAL GLOBE 
102848;10080;GROOVY CACTUS INFLATABLE
5440;10120;DOGGY RUBBER
5439;10123C;HEARTS WRAPPING TAPE 
12443;10124A;SPOTS ON RED BOOKCOVER TAPE
3963;10124G;ARMY CAMO BOOKCOVER TAPE
816;10125;MINI FUNKY DESIGN TAPES
740;10133;COLOURING PENCILS BROWN TUBE
2451;10135;COLOURING PENCILS BROWN TUBE
1844;11001;ASSTD DESIGN RACING CAR PEN
131844;15030;FAN BLACK FRAME 
9166;15034;PAPER POCKET TRAVELING FAN 
4390;15036;ASSORTED COLOURS SILK FAN
8475;15039;SANDALWOOD FAN
39951;15044A;PINK PAPER PARASOL 
1096;15044B;BLUE PAPER PARASOL 
11338;15044C;PURPLE PAPER PARASOL
13873;15044D;RED PAPER PARASOL
132;15056BL;EDWARDIAN PARASOL BLACK
133;15056N;EDWARDIAN PARASOL NATURAL
2298;15056P;EDWARDIAN PARASOL PINK
5358;15056bl;EDWARDIAN PARASOL BLACK
15675;15056n;EDWARDIAN PARASOL NATURAL
5359;15056p;EDWARDIAN PARASOL PINK
23258;15058A;BLUE POLKADOT GARDEN PARASOL
23827;15058B;PINK POLKADOT GARDEN PARASOL
80997;15058C;ICE CREAM DESIGN GARDEN PARASOL
4300;15060B;FAIRY CAKE DESIGN UMBRELLA
347523;15060b;FAIRY CAKE DESIGN UMBRELLA
21189;16008;SMALL FOLDING SCISSOR(POINTED EDGE)
10089;16010;FOLDING CAMPING SCISSOR W/KNIF & S
8549;16011;ANIMAL STICKERS
4016;16012;FOOD/DRINK SPONGE STICKERS
748;16014;SMALL CHINESE STYLE SCISSOR
21187;16015;MEDIUM CHINESE STYLE SCISSOR
747;16016;LARGE CHINESE STYLE SCISSOR
107024;16020C;CLEAR STATIONERY BOX SET 
25142;16033;MINI HIGHLIGHTER PENS
214643;16043;POP ART PUSH DOWN RUBBER 
41214;16045;POPART WOODEN PENCILS ASST
3537;16046;TEATIME PEN CASE & PENS
22412;16048;TEATIME ROUND PENCIL SHARPENER 
167443;16049;TEATIME GEL PENS ASST
14931;16052;TEATIME PUSH DOWN RUBBER
23419;16054;POPART RECT PENCIL SHARPENER ASST
184145;16151A;FLOWERS HANDBAG blue and orange
46987;16156L;WRAP, CAROUSEL
137335;16156L;WRAP CAROUSEL
4069;16156S;WRAP PINK FAIRY CAKES 
119235;16161G;WRAP BAD HAIR DAY
5012;16161M;WRAP  PINK FLOCK
5004;16161P;WRAP ENGLISH ROSE 
9479;16161U;WRAP SUKI AND FRIENDS
53096;16162L;THE KING GIFT BAG
268606;16162M;THE KING GIFT BAG 25x24x12cm
2452;16168M;FUNKY MONKEY GIFT BAG MEDIUM
272150;16169E;WRAP 50'S  CHRISTMAS
13196;16169K;WRAP FOLK ART
44311;16169M;WRAP DAISY CARPET 
11795;16169N;WRAP BLUE RUSSIAN FOLKART
23376;16169P;WRAP GREEN RUSSIAN FOLKART 
117072;16202A;PASTEL PINK PHOTO ALBUM 
158336;16202B;PASTEL BLUE PHOTO ALBUM 
17860;16202E;BLACK PHOTO ALBUM 
42091;16206B;RED PURSE WITH PINK HEART
37486;16207A;PINK STRAWBERRY HANDBAG 
52332;16207B;PINK HEART RED HANDBAG
26201;16216;LETTER SHAPE PENCIL SHARPENER
6159;16218;CARTOON  PENCIL SHARPENERS
14932;16219;HOUSE SHAPE PENCIL SHARPENER
6160;16225;RATTLE SNAKE EGGS
3766;16235;RECYCLED PENCIL WITH RABBIT ERASER
1845;16236;KITTY PENCIL ERASERS
473;16237;SLEEPING CAT ERASERS
512;16238;PARTY TIME PENCIL ERASERS
168196;16244B;MAXWELL 2 TONE BLUE 60 PAGE PHOTO A
112244;16248B;BLUE HOLE PUNCH
226068;16254;TRANSPARENT ACRYLIC TAPE DISPENSER
806;16258A;SWIRLY CIRCULAR RUBBERS IN BAG
121682;16259;PIECE OF CAMO STATIONERY SET
103934;17001;HEAVENS SCENT FRAGRANCE OILS ASSTD
1848;17003;BROCADE RING PURSE 
12375;17007B;S/3 POT POURI CUSHIONS BLUE COLOURS
1849;17011F;ORIGAMI SANDLEWOOD INCENSE+FLOWER
1850;17012A;ORIGAMI VANILLA INCENSE/CANDLE SET 
1851;17012B;ORIGAMI JASMINE INCENSE/CANDLE SET
1852;17012C;ORIGAMI LAVENDER INCENSE/CANDL SET 
1853;17012D;ORIGAMI ROSE INCENSE/CANDLE SET 
1854;17012E;ORIGAMI OPIUM INCENSE/CANDLE SET 
1855;17012F;ORIGAMI SANDLEWOOD INCENSE/CAND SET
18425;17013D;ORIGAMI ROSE INCENSE IN TUBE
2462;17014A;ORIGAMI VANILLA INCENSE CONES
729;17021;NAMASTE SWAGAT INCENSE
77055;17028J;INCENSE BAZAAR PEACH
14664;17038;PORCELAIN BUDAH INCENSE HOLDER
77058;17084A;TRANQUILITY MASALA INCENSE
14697;17084J;LOVE POTION MASALA INCENSE
2463;17084N;FAIRY DREAMS INCENSE 
2464;17084P;DRAGONS BLOOD INCENSE
6353;17084R;ASSORTED INCENSE PACK
3937;17090A;LAVENDER INCENSE 40 CONES IN TIN
3936;17090D;VANILLA INCENSE 40 CONES IN TIN
328;17091A;LAVENDER INCENSE IN TIN
6354;17091J;VANILLA INCENSE IN TIN
18428;17096;ASSORTED LAQUERED INCENSE HOLDERS
6453;17107D;FLOWER FAIRY,5 SUMMER B'DRAW LINERS
345877;17107D;FLOWER FAIRY 5 SUMMER DRAW LINERS
313978;17107D;FLOWER FAIRY 5 DRAWER LINERS
7459;17109D;FLOWER FAIRY INCENSE BOUQUET
1856;17129F;BLUE GLASS GEMS IN BAG
78155;17136A;BLUE STONES ON WIRE FOR CANDLE
1090;17164B;ASS COL SMALL SAND GECKO P'WEIGHT
23178;17165D;ASS COL LARGE SAND FROG P'WEIGHT
58170;17174;ASSTD RASTA KEY-CHAINS
459140;17191A;ROSE FLOWER CANDLE+INCENSE 16X16CM
11371;18007;ESSENTIAL BALM 3.5g TIN IN ENVELOPE
12565;18094C;WHITE AND BLUE CERAMIC OIL BURNER
4133;18097A;PINK TALL PORCELAIN T-LIGHT HOLDER 
4134;18097C;WHITE TALL PORCELAIN T-LIGHT HOLDER
1857;18098C;PORCELAIN BUTTERFLY OIL BURNER
5536;18098c;PORCELAIN BUTTERFLY OIL BURNER
5125;20615;BLUE POLKADOT PASSPORT COVER
2078;20616;CHERRY BLOSSOM PASSPORT COVER
2466;20617;FIRST CLASS PASSPORT COVER 
17785;20618;QUEEN OF THE SKIES PASSPORT COVER 
2467;20619;TROPICAL PASSPORT COVER 
242261;20622;VIP PASSPORT COVER 
1858;20622;VIPPASSPORT COVER 
7022;20652;BLUE POLKADOT LUGGAGE TAG 
2468;20653;CHERRY BLOSSOM LUGGAGE TAG
23164;20654;FIRST CLASS LUGGAGE TAG 
5538;20655;QUEEN OF SKIES LUGGAGE TAG
7036;20657;TROPICAL LUGGAGE TAG
1859;20658;RED RETROSPOT LUGGAGE TAG
9621;20659;ECONOMY LUGGAGE TAG
7018;20661;BLUE POLKADOT PURSE 
1860;20662;FIRST CLASS HOLIDAY PURSE 
16662;20663;QUEEN OF THE SKIES HOLIDAY PURSE 
25741;20664;TROPICAL HOLIDAY PURSE 
3042;20665;RED RETROSPOT PURSE 
25846;20666;ECONOMY HOLIDAY PURSE
206688;20667;CHERRY BLOSSOM PURSE
219;20668;DISCO BALL CHRISTMAS DECORATION
495;20669;RED HEART LUGGAGE TAG
25745;20670;VIP HOLIDAY PURSE
9197;20671;BLUE TEATIME PRINT BOWL 
3491;20674;GREEN POLKADOT BOWL
3863;20675;BLUE POLKADOT BOWL
1863;20676;RED RETROSPOT BOWL
3895;20677;PINK POLKADOT BOWL
355531;20678;LARGE BLACK DIAMANTE HAIRSLIDE
52;20679;EDWARDIAN PARASOL RED
2470;20681;PINK POLKADOT CHILDRENS UMBRELLA
2471;20682;RED RETROSPOT CHILDRENS UMBRELLA
1864;20684;STRAWBERRY DREAM CHILDS UMBRELLA
454;20685;DOORMAT RED RETROSPOT
6166;20686;DOLLY MIXTURE CHILDREN'S UMBRELLA
35465;20694;FLORAL PINK MONSTER
19073;20695;FLORAL BLUE MONSTER
2472;20696;FLORAL SOFT CAR TOY
2018;20697;LITTLE GREEN MONSTER SOFT TOY
52343;20698;LITTLE PINK MONSTER SOFT TOY
2473;20699;MOUSEY LONG LEGS SOFT TOY
2474;20700;GREEN CAT FLORAL CUSHION COVER 
42129;20701;PINK CAT FLORAL CUSHION COVER 
9074;20702;PINK PADDED MOBILE
18128;20703;BLUE PADDED SOFT MOBILE
27459;20704;MR ROBOT SOFT TOY
29679;20705;MRS ROBOT SOFT TOY
945;20707;CRAZY DAISY HEART DECORATION
1437;20711;JUMBO BAG TOYS 
1115;20712;JUMBO BAG WOODLAND ANIMALS
522;20713;JUMBO BAG OWLS
10191;20716;PARTY FOOD SHOPPER BAG
535;20717;STRAWBERRY SHOPPER BAG
2476;20718;RED RETROSPOT SHOPPER BAG
1866;20719;WOODLAND CHARLOTTE BAG
89;20723;STRAWBERRY CHARLOTTE BAG
1867;20724;RED RETROSPOT CHARLOTTE BAG
93;20725;LUNCH BAG RED RETROSPOT
57802;20725;LUNCH BAG RED SPOTTY
370;20726;LUNCH BAG WOODLAND
413;20727;LUNCH BAG  BLACK SKULL.
412;20728;LUNCH BAG CARS BLUE
11827;20731;POSY CANDY BAG
1869;20733;GOLD MINI TAPE MEASURE 
6817;20734;SILVER MINI TAPE MEASURE 
1870;20735;BLACK MINI TAPE MEASURE 
9058;20748;KENSINGTON COFFEE SET
367;20749;ASSORTED COLOUR MINI CASES
621;20750;RED RETROSPOT MINI CASES
4639;20751;FUNKY WASHING UP GLOVES ASSORTED
2483;20752;BLUE POLKADOT WASHING UP GLOVES
1011;20754;RETROSPOT RED WASHING UP GLOVES
3097;20755;BLUE PAISLEY POCKET BOOK
64521;20756;GREEN FERN POCKET BOOK
4212;20757;RED DAISY POCKET BOOK 
21236;20758;ABSTRACT CIRCLES POCKET BOOK
4210;20759;CHRYSANTHEMUM POCKET BOOK 
4211;20760;GARDEN PATH POCKET BOOK
2485;20761;BLUE PAISLEY SKETCHBOOK
11359;20762;GREEN FERN SKETCHBOOK 
14963;20763;DAISY SKETCHBOOK 
8687;20764;ABSTRACT CIRCLES SKETCHBOOK 
3063;20765;CHRYSANTHEMUM SKETCHBOOK 
4607;20766;GARDEN PATH SKETCHBOOK
5450;20767;BLUE PAISLEY JOURNAL 
2430;20768;GREEN FERN JOURNAL 
11805;20769;DAISY JOURNAL 
1871;20770;ABSTRACT CIRCLE JOURNAL 
10051;20771;CHRYSANTHEMUM  JOURNAL
1007;20772;GARDEN PATH JOURNAL
745;20773;BLUE PAISLEY NOTEBOOK
744;20774;GREEN FERN NOTEBOOK
12170;20775;DAISY NOTEBOOK 
746;20777;CHRYSANTHEMUM NOTEBOOK
21233;20778;GARDEN PATH NOTEBOOK 
2432;20780;BLACK EAR MUFF HEADPHONES
10104;20781;GOLD EAR MUFF HEADPHONES
10203;20782;CAMOUFLAGE EAR MUFF HEADPHONES
44637;20785;FUSCHIA RETRO BAR STOOL
25713;20793;BLUE TILED TRAY
16678;20794;BLUE  TILE HOOK
61901;20795;LARGE BLUE PROVENCAL CERAMIC BALL
106148;20796;SMALL BLUE PROVENCAL CERAMIC BALL
3839;20798;CLEAR MILKSHAKE GLASS
14965;20801;LARGE PINK GLASS SUNDAE DISH
10101;20802;SMALL GLASS SUNDAE DISH CLEAR
11360;20803;SMALL PINK GLASS SUNDAE DISH
170238;20816;GOLD FLOWER CUSHION COVER 
27467;20818;GOLD TEDDY BEAR
13010;20819;SILVER TEDDY BEAR
336;20820;SILVER LOOKING MIRROR
138543;20821;GOLDIE LOOKING MIRROR
162954;20823;GOLD WINE GOBLET
28496;20826;SILVER APERITIF GLASS
162955;20827;GOLD APERITIF GLASS
4027;20828;GLITTER BUTTERFLY CLIPS
7290;20829;GLITTER HANGING BUTTERFLY STRING
25156;20830;SILVER PHOTO FRAME
25158;20831;GOLD PHOTO FRAME
3770;20832;RED FLOCK LOVE HEART PHOTO FRAME
1873;20835;FRENCH LATTICE CUSHION COVER 
171746;20836;FRENCH PAISLEY CUSHION COVER
93430;20837;FRENCH FLORAL CUSHION COVER 
169785;20838;FRENCH LATTICE CUSHION COVER 
1874;20839;FRENCH PAISLEY CUSHION COVER 
1875;20840;FRENCH FLORAL CUSHION COVER 
61400;20845;ZINC HEART LATTICE 2 WALL PLANTER
2487;20846;ZINC HEART LATTICE T-LIGHT HOLDER
10205;20847;ZINC HEART LATTICE CHARGER LARGE
28458;20848;ZINC HEART LATTICE CHARGER SMALL
75238;20851;ZINC HEART LATTICE TRAY OVAL 
1836;20854;BLUE PATCH PURSE PINK HEART
1835;20856;DENIM PATCH PURSE PINK BUTTERFLY
14056;20857;BLUE ROSE PATCH PURSE PINK BUTTERFL
28786;20860;GOLD COSMETICS BAG WITH BUTTERFLY
12221;20861;GOLD COSMETIC BAG PINK STAR
823;20866;BLUE ROSE FABRIC MIRROR
1336;20867;PINK ROSE FABRIC MIRROR
23268;20868;SILVER FABRIC MIRROR
35475;20869;GOLD FABRIC MIRROR
30591;20871;OPULENT VELVET SET/3 CANDLES
822;20878;SET/9 CHRISTMAS T-LIGHTS SCENTED 
5488;20886;BOX OF 9 PEBBLE CANDLES
14971;20892;SET/3 TALL GLASS CANDLE HOLDER PINK
3270;20893;HANGING BAUBLE T-LIGHT HOLDER SMALL
4104;20894;HANGING BAUBLE T-LIGHT HOLDER LARGE
11594;20897;VINTAGE NOTEBOOK PARIS DAYS
73733;20898;VINTAGE NOTEBOOK TRAVELOGUE
216135;20901;VINTAGE KEEPSAKE BOX PINK FLOWER
1395;20902;VINTAGE KEEPSAKE BOX PARIS DAYS
11593;20903;VINTAGE KEEPSAKE BOX TRAVELOGUE
18098;20906;VINTAGE NOTEBOOK BEAUTY GIRL
6966;20910;VINTAGE PHOTO ALBUM PARIS DAYS
57791;20914;SET/5 RED SPOTTY LID GLASS BOWLS
415;20914;SET/5 RED RETROSPOT LID GLASS BOWLS
2489;20931;BLUE POT PLANT CANDLE 
22444;20932;PINK POT PLANT CANDLE
44725;20933;YELLOW POT PLANT CANDLE
36295;20934;SET/3 POT PLANT CANDLES
355231;20935;ROUND CACTUS CANDLE
7393;20936;FORKED CACTUS CANDLE
5362;20941;FROG CANDLE
35481;20954;*USB Office Mirror Ball
1879;20956;PORCELAIN T-LIGHT HOLDERS ASSORTED
1981;20957;PORCELAIN HANGING BELL SMALL
6819;20960;WATERMELON BATH SPONGE
355;20961;STRAWBERRY BATH SPONGE 
354;20963;APPLE BATH SPONGE
176445;20964;POLYESTER FILLER PAD 60x40cm
353;20966;SANDWICH BATH SPONGE
3588;20967;GREY FLORAL FELTCRAFT SHOULDER BAG
1883;20969;RED FLORAL FELTCRAFT SHOULDER BAG
3032;20970;PINK FLORAL FELTCRAFT SHOULDER BAG
1884;20971;PINK BLUE FELT CRAFT TRINKET BOX
1020;20972;PINK CREAM FELT CRAFT TRINKET BOX 
1095;20973;12 PENCIL SMALL TUBE WOODLAND
1094;20974;12 PENCILS SMALL TUBE SKULL
1887;20975;12 PENCILS SMALL TUBE RED RETROSPOT
872;20977;36 PENCILS TUBE WOODLAND
2429;20978;36 PENCILS TUBE SKULLS
871;20979;36 PENCILS TUBE RED RETROSPOT
8860;20980;36 PENCILS TUBE POSY
1888;20981;12 PENCILS TALL TUBE WOODLAND
437;20982;12 PENCILS TALL TUBE SKULLS
3611;20983;12 PENCILS TALL TUBE RED RETROSPOT
4011;20984;12 PENCILS TALL TUBE POSY
9624;20985;HEART CALCULATOR
3769;20986;BLUE CALCULATOR RULER
362;20992;JAZZ HEARTS PURSE NOTEBOOK
1890;20996;JAZZ HEARTS ADDRESS BOOK
163077;20997;ROSE DU SUD CUSHION COVER 
5685;20998;ROSE DU SUD OVEN GLOVE
1891;21000;ROSE DU SUD COSMETICS BAG
13237;21001;ROSE DU SUD WASHBAG 
2497;21002;ROSE DU SUD DRAWSTRING BAG
48679;21003;ROSE DU SUD CUSHION COVER
37127;21009;ETCHED GLASS STAR TREE DECORATION
7464;21011;GLITTER SNOW PEAR TREE DECORATION
1892;21012;ANTIQUE ALL GLASS CANDLESTICK
2217;21014;SWISS CHALET TREE DECORATION 
2499;21015;DARK BIRD HOUSE TREE DECORATION
2220;21018;BIRD BOX CHRISTMAS TREE DECORATION
4580;21025;SPACE FROG
4583;21026;SPACE OWL
6357;21027;NINJA RABBIT PINK
13243;21028;NINJA RABBIT BLACK
4582;21030;SPACE CADET RED
4581;21031;SPACE CADET BLACK
4585;21032;SPACE CADET WHITE
88;21033;JUMBO BAG CHARLIE AND LOLA TOYS
591;21034;REX CASH+CARRY JUMBO SHOPPER
33;21035;SET/2 RED RETROSPOT TEA TOWELS 
1197;21038;SET/4 MODERN VINTAGE COTTON NAPKINS
4992;21039;RED RETROSPOT SHOPPING BAG
7148;21040;MODERN VINTAGE COTTON SHOPPING BAG
1022;21041;RED RETROSPOT OVEN GLOVE DOUBLE
3151;21042;RED RETROSPOT APRON 
32957;21043;APRON MODERN VINTAGE COTTON
6202;21051;RIBBONS PURSE 
7106;21054;NURSE'S BAG SOFT TOY
1417;21055;TOOL BOX SOFT TOY 
1418;21056;DOCTOR'S BAG SOFT TOY
3306;21058;PARTY INVITES WOODLAND
4884;21059;PARTY INVITES DINOSAURS
3307;21060;PARTY INVITES BALLOON GIRL
400;21061;PARTY INVITES FOOTBALL
402;21062;PARTY INVITES SPACEMAN
401;21063;PARTY INVITES JAZZ HEARTS
3754;21064;BOOM BOX SPEAKER BOYS
519;21065;BOOM BOX SPEAKER GIRLS
5363;21066;VINTAGE RED MUG
2502;21067;VINTAGE RED TEATIME MUG
56;21068;VINTAGE BILLBOARD LOVE/HATE MUG
1896;21069;VINTAGE BILLBOARD TEA MUG
1897;21070;VINTAGE BILLBOARD MUG 
55;21071;VINTAGE BILLBOARD DRINK ME MUG
5734;21078;SET/20 STRAWBERRY PAPER NAPKINS 
224;21080;SET/20 RED RETROSPOT PAPER NAPKINS 
57816;21082;SET/20 FRUIT SALAD PAPER NAPKINS 
47712;21084;SET/6 COLLAGE PAPER CUPS
226;21086;SET/6 RED SPOTTY PAPER CUPS
94380;21087;SET/6 POSIES PAPER CUPS
47714;21088;SET/6 FRUIT SALAD PAPER CUPS
12073;21089;SET/6 GREEN SPRING PAPER CUPS
8415;21090;SET/6 COLLAGE PAPER PLATES
92;21094;SET/6 RED SPOTTY PAPER PLATES
6364;21095;SET/6 POSIES PAPER PLATES
47718;21096;SET/6 FRUIT SALAD  PAPER PLATES
1045;21098;CHRISTMAS TOILET ROLL
5550;21100;CHARLIE AND LOLA CHARLOTTE BAG
1083;21106;CREAM SLICE FLANNEL CHOCOLATE SPOT 
1084;21107;CREAM SLICE FLANNEL PINK SPOT 
375;21108;FAIRY CAKE FLANNEL ASSORTED COLOUR
2507;21109;LARGE CAKE TOWEL, CHOCOLATE SPOTS
28674;21109;LARGE CAKE TOWEL CHOCOLATE SPOTS
2508;21110;LARGE CAKE TOWEL PINK SPOTS
1013;21111;SWISS ROLL TOWEL, CHOCOLATE  SPOTS
6209;21112;SWISS ROLL TOWEL, PINK  SPOTS
64816;21112;SWISS ROLL TOWEL PINK  SPOTS
5118;21114;LAVENDER SCENTED FABRIC HEART
194;21115;ROSE CARAVAN DOORSTOP
524;21116;OWL DOORSTOP
56361;21117;BLOND DOLL DOORSTOP
20598;21120;*Boombox Ipod Classic
778;21121;SET/10 RED POLKADOT PARTY CANDLES
347;21122;SET/10 PINK POLKADOT PARTY CANDLES
999;21123;SET/10 IVORY POLKADOT PARTY CANDLES
809;21124;SET/10 BLUE POLKADOT PARTY CANDLES
394;21125;SET 6 FOOTBALL CELEBRATION CANDLES
395;21126;SET OF 6 GIRLS CELEBRATION CANDLES
2510;21128;GOLD FISHING GNOME
4871;21129;SILVER FISHING GNOME 
23087;21131;GOLD STANDING GNOME
21406;21132;SILVER STANDING GNOME   
1099;21135;VICTORIAN  METAL POSTCARD SPRING
2403;21136;PAINTED METAL PEARS ASSORTED
869;21137;BLACK RECORD COVER FRAME
1367;21143;ANTIQUE GLASS HEART DECORATION 
21789;21144;PINK POODLE HANGING DECORATION 
28498;21145;ANTIQUE GLASS PLACE SETTING
1906;21147;JINGLE BELLS TREE DECORATION
727;21154;RED RETROSPOT OVEN GLOVE 
4299;21155;RED RETROSPOT PEG BAG
739;21156;RETROSPOT CHILDRENS APRON
4993;21157;RED RETROSPOT WASHBAG
1908;21158;MOODY GIRL DOOR HANGER 
3629;21159;MOODY BOY  DOOR HANGER 
30595;21160;KEEP OUT GIRLS DOOR HANGER 
3628;21161;KEEP OUT BOYS DOOR HANGER 
11683;21162;TOXIC AREA  DOOR HANGER 
3626;21163;DO NOT TOUCH MY STUFF DOOR HANGER 
2512;21164;HOME SWEET HOME METAL SIGN 
1909;21165;BEWARE OF THE CAT METAL SIGN 
118;21166;COOK WITH WINE METAL SIGN 
10095;21167;WHITE SAGE INCENSE
117;21169;YOU'RE CONFUSING ME METAL SIGN 
13262;21171;BATHROOM METAL SIGN 
3159;21172;PARTY METAL SIGN 
1912;21174;POTTERING IN THE SHED METAL SIGN
119;21175;GIN + TONIC DIET METAL SIGN
499770;21175;GIN AND TONIC DIET METAL SIGN
1202;21179;NO JUNK MAIL METAL SIGN
2146;21181;PLEASE ONE PERSON METAL SIGN
30597;21186;WHITE DOVE HONEYCOMB PAPER GARLAND
8735;21187;WHITE BELL HONEYCOMB PAPER GARLAND 
2516;21188;3D HEARTS  HONEYCOMB PAPER GARLAND
1914;21189;WHITE HONEYCOMB PAPER GARLAND 
907;21190;PINK HEARTS PAPER GARLAND
1915;21191;LARGE WHITE HONEYCOMB PAPER BELL  
1053;21192;WHITE BELL HONEYCOMB PAPER 
26657;21194;PINK  HONEYCOMB PAPER FAN
1916;21195;PINK  HONEYCOMB PAPER BALL 
32164;21196;ROUND WHITE CONFETTI IN TUBE
1033;21197;MULTICOLOUR  CONFETTI IN TUBE
38098;21198;WHITE HEART CONFETTI IN TUBE
27501;21199;PINK  HEART CONFETTI IN TUBE
6177;21200;MULTICOLOUR HONEYCOMB PAPER GARLAND
5559;21201;TROPICAL  HONEYCOMB PAPER GARLAND 
9873;21202;DOLLY HONEYCOMB GARLAND
13270;21204;DAISIES  HONEYCOMB GARLAND 
5371;21205;MULTICOLOUR 3D BALLS GARLAND
3887;21206;STRAWBERRY HONEYCOMB  GARLAND 
1917;21207;SKULL AND CROSSBONES  GARLAND 
2519;21208;PASTEL COLOUR HONEYCOMB FAN
8417;21209;MULTICOLOUR HONEYCOMB FAN
470;21210;SET OF 72 RETROSPOT PAPER  DOILIES
3988;21211;SET OF 72 SKULL PAPER  DOILIES
96;21212;PACK OF 72 RETROSPOT CAKE CASES
406;21213;PACK OF 72 SKULL CAKE CASES
3296;21215;IVORY PAPER CUP CAKE CASES 
1921;21216;SET 3 RETROSPOT TEA,COFFEE,SUGAR
1922;21217;RED RETROSPOT ROUND CAKE TINS
1839;21218;RED SPOTTY BISCUIT TIN
6226;21219;SET/4 BADGES BALLOON GIRL
2522;21220;SET/4 BADGES DOGS
3096;21221;SET/4 BADGES CUTE CREATURES
13274;21222;SET/4 BADGES BEETLES
6229;21224;SET/4 SKULL BADGES
11902;21226;POCKET MIRROR WOODLAND
84012;21228;"POCKET MIRROR ""GLAMOROUS"""
1924;21231;SWEETHEART CERAMIC TRINKET BOX
414380;21232;STRAWBERRY CERAMIC TRINKET POT
307;21232;STRAWBERRY CERAMIC TRINKET BOX
1926;21238;RED RETROSPOT CUP
3864;21239;PINK  POLKADOT CUP
4912;21240;BLUE POLKADOT CUP
553;21242;RED RETROSPOT PLATE 
554;21243;PINK  POLKADOT PLATE 
444308;21243;PINK POLKADOT PLATE 
552;21244;BLUE POLKADOT PLATE 
551;21245;GREEN POLKADOT PLATE 
17683;21246;RED RETROSPOT BIG BOWL
26354;21248;DOOR HANGER  MUM + DADS ROOM
1927;21249;WOODLAND  HEIGHT CHART STICKERS 
6429;21250;SET OF SKULL WALL STICKERS
13278;21251;DINOSAUR HEIGHT CHART STICKER SET
11002;21253;SET OF PICTURE FRAME  STICKERS
777;21257;VICTORIAN SEWING BOX MEDIUM
65;21258;VICTORIAN SEWING BOX LARGE
776;21259;VICTORIAN SEWING BOX SMALL 
793;21260;FIRST AID TIN
6235;21261;GREEN GOOSE FEATHER CHRISTMAS TREE 
1929;21262;WHITE GOOSE FEATHER CHRISTMAS TREE 
6237;21263;GREEN GOOSE FEATHER TREE 60CM
20623;21264;WHITE GOOSE FEATHER TREE 60CM 
11006;21265;PINK GOOSE FEATHER TREE 60CM
4570;21268;VINTAGE BLUE TINSEL REEL
16717;21269;ANTIQUE CREAM CUTLERY SHELF 
41566;21270;ANTIQUE CREAM CUTLERY CUPBOARD
2529;21272;SALLE DE BAIN HOOK
17263;21275;ZINC TOP  2 DOOR WOODEN SHELF 
9560;21277;FRENCH STYLE EMBOSSED HEART CABINET
46196;21278;VINTAGE KITCHEN PRINT PUDDINGS
2530;21279;VINTAGE KITCHEN PRINT FRUITS
51422;21280;VINTAGE KITCHEN PRINT VEGETABLES
2531;21281;VINTAGE KITCHEN PRINT SEAFOOD
20624;21284;RETROSPOT CANDLE  SMALL
18498;21285;RETROSPOT CANDLE  MEDIUM
6239;21286;RETROSPOT CANDLE  LARGE
7174;21287;SCENTED VELVET LOUNGE CANDLE 
2532;21288;STRIPEY CHOCOLATE NESTING BOXES
11440;21289;LARGE STRIPES CHOCOLATE GIFT BAG
10258;21291;SMALL POLKADOT CHOCOLATE GIFT BAG 
949;21292;SMALL STRIPES CHOCOLATE GIFT BAG 
27513;21293;MIRRORED DOVE WALL DECORATION
8198;21294;ETCHED GLASS COASTER
9541;21306;SET/4 DAISY MIRROR MAGNETS
9543;21307;SET/4 BUTTERFLY MIRROR MAGNETS
201299;21310;CAPIZ CHANDELIER
9542;21311;SET/4 BIRD MIRROR MAGNETS 
1930;21313;GLASS HEART T-LIGHT HOLDER 
270;21314;SMALL GLASS HEART TRINKET POT
15015;21316;SMALL CHUNKY GLASS ROMAN  BOWL
21801;21317;GLASS SPHERE CANDLE STAND MEDIUM
24200;21318;GLASS CHALICE BLUE SMALL 
10261;21319;GLASS CHALICE GREEN  SMALL 
64835;21320;GLASS CHALICE GREEN  LARGE 
158;21324;HANGING MEDINA LANTERN SMALL
518;21326;AGED GLASS SILVER T-LIGHT HOLDER
850;21327;SKULLS WRITING SET 
326;21328;BALLOONS  WRITING SET 
848;21329;DINOSAURS  WRITING SET 
28449;21331;MOROCCAN BEATEN METAL DISH LARGE
49698;21332;MOROCCAN BEATEN METAL MIRROR
1223;21333;CLASSIC WHITE FRAME
12903;21336;GOLD WASHBAG
163;21340;CLASSIC METAL BIRDCAGE PLANT HOLDER
72364;21344;MOROCCAN BEATEN METAL DISH
32494;21348;PINK SPOTS CHOCOLATE NESTING BOXES 
1934;21349;IVY HEART WREATH
2192;21351;CINAMMON & ORANGE WREATH
1935;21352;EUCALYPTUS & PINECONE  WREATH
1936;21354;TOAST ITS - BEST MUM
3329;21355;TOAST ITS - I LOVE YOU 
2538;21356;TOAST ITS - FAIRY FLOWER
4598;21357;TOAST ITS - DINOSAUR
998;21358;TOAST ITS - HAPPY BIRTHDAY
10267;21359;RELAX LARGE WOOD LETTERS
3244;21360;JOY LARGE WOOD LETTERS
5375;21361;LOVE LARGE WOOD LETTERS 
186;21363;HOME SMALL WOOD LETTERS
3145;21364;PEACE SMALL WOOD LETTERS
1937;21365;MIRRORED WALL ART STARS
1938;21366;MIRRORED WALL ART PHOTO FRAMES
898;21367;MIRRORED WALL ART GENTS
58074;21368;MIRRORED WALL ART LADIES
1939;21369;MIRRORED WALL ART SPLODGES
897;21370;MIRRORED WALL ART FOXY
55409;21371;MIRRORED WALL ART POPPIES
1940;21372;MIRRORED WALL ART TABLE LAMP
214632;21373;MIRRORED WALL ART SNOWFLAKES
2342;21374;MIRRORED WALL ART SKULLS
13298;21375;LARGE CAMPHOR WOOD FIELD MUSHROOM 
17733;21376;LARGE  TALL CAMPHOR WOOD TOADSTOOL 
6450;21377;SMALL CAMPHOR WOOD FIELD  MUSHROOM
25479;21378;SMALL TALL CAMPHOR WOOD TOADSTOOL
6451;21379;CAMPHOR WOOD PORTOBELLO MUSHROOM
3094;21380;WOODEN HAPPY BIRTHDAY GARLAND
3645;21381;MINI WOODEN HAPPY BIRTHDAY GARLAND
20169;21382;SET/4 SPRING FLOWER DECORATION
3644;21383;PACK OF 12 STICKY BUNNIES
1941;21385;IVORY HANGING DECORATION  HEART
31016;21386;IVORY HANGING DECORATION  EGG
11018;21389;IVORY HANGING DECORATION  BIRD
3638;21390;FILIGRIS HEART WITH BUTTERFLY
11019;21391;FRENCH LAVENDER SCENT HEART
4566;21392;RED POLKADOT PUDDING BOWL
4567;21393;BLUE POLKADOT PUDDING BOWL
41345;21394;RED POLKADOT BEAKER 
117156;21395;BLUE POLKADOT BEAKER 
10269;21397;BLUE POLKADOT EGG CUP 
2434;21398;RED POLKADOT COFFEE  MUG
4614;21399;BLUE POLKADOT COFFEE MUG
32639;21400;RED PUDDING SPOON
9524;21401;BLUE PUDDING SPOON
36347;21402;RED  EGG  SPOON
11020;21403;BLUE EGG  SPOON
1942;21407;BROWN CHECK CAT DOORSTOP 
1943;21408;SPOTTY PINK DUCK DOORSTOP
15692;21410;COUNTRY COTTAGE  DOORSTOP GREEN
187;21411;GINGHAM HEART  DOORSTOP RED
44011;21412;VINTAGE GOLD TINSEL REEL
8405;21413;PERIWINKLE T-LIGHT HOLDER
97894;21414;SCALLOP SHELL SOAP DISH
4108;21415;CLAM SHELL SMALL 
4119;21416;CLAM SHELL LARGE
4121;21417;COCKLE SHELL DISH
24208;21418;STARFISH SOAP DISH
24209;21420;OYSTER TRINKET BOX
3098;21421;PORCELAIN ROSE LARGE 
3099;21422;PORCELAIN ROSE SMALL
9448;21424;WOODLAND STORAGE BOX LARGE 
33104;21425;SKULLS STORAGE BOX LARGE
4665;21426;WOODLAND STORAGE BOX SMALL
1004;21427;SKULLS STORAGE BOX SMALL
3505;21428;SET3 BOOK BOX GREEN GINGHAM FLOWER 
1396;21429;RED GINGHAM ROSE JEWELLERY BOX
3599;21430;SET/3 RED GINGHAM ROSE STORAGE BOX
2540;21439;BASKET OF TOADSTOOLS
933;21441;BLUE BIRDHOUSE DECORATION
18512;21442;GREEN BIRDHOUSE DECORATION
8128;21445;12 PINK ROSE PEG PLACE SETTINGS
6251;21446;12 RED ROSE PEG PLACE SETTINGS
2541;21447;12 IVORY ROSE PEG PLACE SETTINGS
565;21448;12 DAISY PEGS IN WOOD BOX
1155;21452;TOADSTOOL MONEY BOX
23811;21454;PAINTED PINK RABBIT 
35537;21455;PAINTED YELLOW WOODEN DAISY
67696;21456;2 PICTURE BOOK EGGS EASTER CHICKS
67483;21457;2 PICTURE BOOK EGGS EASTER DUCKS
59389;21458;2 PICTURE BOOK EGGS EASTER BUNNY
56588;21459;YELLOW EASTER EGG HUNT START POST
56589;21460;GREEN EASTER EGG HUNT START POST
58582;21461;BLUE EASTER EGG HUNT START POST
2177;21462;NURSERY A,B,C PAINTED LETTERS
334;21463;MIRRORED DISCO BALL 
335;21464;DISCO BALL ROTATOR BATTERY OPERATED
4013;21465;PINK FLOWER CROCHET FOOD COVER
1345;21466;RED FLOWER CROCHET FOOD COVER
1346;21467;CHERRY CROCHET FOOD COVER
8216;21468;BUTTERFLY CROCHET FOOD COVER
1348;21469;POLKA DOT RAFFIA FOOD COVER
4014;21470;FLOWER VINE RAFFIA FOOD COVER
1347;21471;STRAWBERRY RAFFIA FOOD COVER
3047;21472;LADYBIRD + BEE RAFFIA FOOD COVER
28577;21473;SWEETHEART CREAM STEEL TABLE RECT
71035;21476;STEEL SWEETHEART ROUND TABLE CREAM
313;21479;WHITE SKULL HOT WATER BOTTLE 
702;21481;FAWN BLUE HOT WATER BOTTLE
239;21484;CHICK GREY HOT WATER BOTTLE
229;21485;RETROSPOT HEART HOT WATER BOTTLE
958;21486;PINK HEART DOTS HOT WATER BOTTLE
925;21488;RED WHITE SCARF  HOT WATER BOTTLE
33655;21491;SET OF THREE VINTAGE GIFT WRAPS
681;21494;ROTATING LEAVES T-LIGHT HOLDER
2028;21495;SKULLS AND CROSSBONES WRAP
1222;21497;FANCY FONTS BIRTHDAY WRAP
1216;21498;RED RETROSPOT WRAP 
4441;21499;BLUE POLKADOT WRAP
4376;21500;PINK POLKADOT WRAP 
37462;21503;TOYBOX  WRAP 
3983;21504;SKULLS GREETING CARD
253;21506;FANCY FONT BIRTHDAY CARD, 
1949;21507;ELEPHANT, BIRTHDAY CARD, 
314077;21507;ELEPHANT BIRTHDAY CARD 
4437;21508;VINTAGE KID DOLLY CARD 
2348;21509;COWBOYS AND INDIANS BIRTHDAY CARD 
3331;21518;BANK ACCOUNT  GREETING  CARD 
1212;21519;GIN & TONIC DIET GREETING CARD 
1255;21520;BOOZE & WOMEN GREETING CARD 
140;21523;DOORMAT FANCY FONT HOME SWEET HOME
1351;21524;DOORMAT SPOTTY HOME SWEET HOME
3617;21527;RED RETROSPOT TRADITIONAL TEAPOT 
5103;21528;DAIRY MAID TRADITIONAL TEAPOT 
5102;21530;DAIRY MAID TOASTRACK
4984;21531;RED RETROSPOT SUGAR JAM BOWL
130;21533;RETROSPOT LARGE MILK JUG
11032;21534;DAIRY MAID LARGE MILK JUG
20358;21535;RED RETROSPOT SMALL MILK JUG
2551;21537;RED RETROSPOT PUDDING BOWL
3618;21538;DAIRY MAID  PUDDING BOWL
4406;21539;RED RETROSPOT BUTTER DISH
441;21544;SKULLS  WATER TRANSFER TATTOOS 
2553;21547;CERAMIC BIRDHOUSE CRESTED TIT SMALL
7874;21555;CERAMIC STRAWBERRY TRINKET TRAY
714;21556;CERAMIC STRAWBERRY MONEY BOX
131;21557;SET OF 6 FUNKY BEAKERS
5568;21558;SKULL LUNCH BOX WITH CUTLERY 
94;21559;STRAWBERRY LUNCH BOX WITH CUTLERY
3846;21561;DINOSAUR LUNCH BOX WITH CUTLERY
22345;21562;HAWAIIAN GRASS SKIRT 
1952;21563;RED HEART SHAPE LOVE BUCKET 
1953;21564;PINK  HEART SHAPE LOVE BUCKET 
1408;21576;LETS GO SHOPPING COTTON TOTE BAG
891;21577;SAVE THE PLANET COTTON TOTE BAG
4590;21578;WOODLAND DESIGN  COTTON TOTE BAG
1407;21579;LOLITA  DESIGN  COTTON TOTE BAG
8986;21580;RABBIT  DESIGN  COTTON TOTE BAG
