;StockCode;Description
168046;23069;EDWARDIAN PHOTO FRAME
173645;23070;EDWARDIAN HEART PHOTO FRAME
177988;23071;MARIE ANTOINETTE TRINKET BOX GOLD
163920;23071;MARIE ANTOIENETT TRINKET BOX GOLD
177993;23072;MARIE ANTOINETTE TRINKET BOX SILVER
161792;23073;GEORGIAN TRINKET BOX
333099;23074;EMBOSSED HEART TRINKET BOX
161588;23075;PARLOUR CERAMIC WALL HOOK
160805;23075;DOUBLE CERAMIC PARLOUR HOOK
130780;23076;ICE CREAM SUNDAE LIP GLOSS
130711;23077;DOUGHNUT LIP GLOSS 
130956;23078;ICE CREAM PEN LIP GLOSS 
184654;23079;TOADSTOOL BEDSIDE LIGHT 
226319;23079; TOADSTOOL BEDSIDE LIGHT 
183824;23080;RED METAL BOX TOP SECRET
182003;23081;GREEN METAL BOX ARMY SUPPLIES
183893;23081;GREEN METAL BOX TOP SECRET
184096;23082;SET 6 PAPER TABLE LANTERN HEARTS 
188787;23083;SET 6 PAPER TABLE LANTERN STARS 
182093;23084;RABBIT NIGHT LIGHT
190024;23085;ANTIQUE SILVER BAUBLE LAMP  
204136;23086;ZINC STAR T-LIGHT HOLDER 
190479;23086;ZINC  STAR T-LIGHT HOLDER 
187935;23087;ZINC  HEART T-LIGHT HOLDER
186923;23088;ZINC HEART FLOWER T-LIGHT HOLDER
186454;23089;GLASS BON BON JAR
189576;23090;VINTAGE GLASS T-LIGHT HOLDER
183763;23091;ZINC HERB GARDEN CONTAINER
187937;23091;METAL HERB GERDEN CONTAINER
189857;23092;LARGE ANTIQUE WHITE PHOTO FRAME
184158;23093;SMALL PARISIENNE HEART PHOTO FRAME 
183814;23094;LE GRAND TRAY CHIC SET
183651;23096;PETIT TRAY CHIC
190344;23099;FRENCH CARRIAGE LANTERN
184091;23100;SILVER BELLS TABLE DECORATION
185973;23101;SILVER STARS TABLE DECORATION
184092;23102;SILVER HEARTS TABLE DECORATION
187028;23103;JINGLE BELL HEART DECORATION
184247;23103;BELL HEART DECORATION
194572;23104;IVORY CAFE HANGING LAMP 
184892;23104;IVORY PANTRY HANGING LAMP 
187607;23106;ZINC HEARTS PLANT POT HOLDER
187949;23106;ZINC PLANT POT HOLDER
186479;23107;WHITE WIRE PLANT POT HOLDER
187608;23107;WHITE HEARTS WIRE PLANT POT HOLDER
183822;23108;SET OF 10 LED DOLLY LIGHTS
264729;23109;PACK OF SIX LED TEA LIGHTS
184236;23109;LED TEA LIGHTS
183908;23110;PARISIENNE KEY CABINET 
184649;23111;PARISIENNE SEWING BOX
184344;23112;PARISIENNE CURIO CABINET
342209;23113;PANTRY CHOPPING BOARD
368241;23114;VINTAGE LEAF CHOPPING BOARD  
368243;23115;RED APPLES CHOPPING BOARD   
368647;23116;VEGETABLE GARDEN CHOPPING BOARD
368242;23117;POPPY FIELDS CHOPPING BOARD
182656;23118;PARISIENNE JEWELLERY DRAWER 
228905;23119;PACK OF 6 LARGE FRUIT STRAWS 
229309;23120;PACK OF 6 SMALL FRUIT STRAWS
229311;23121;PACK OF 6 COCKTAIL PARASOL STRAWS
229162;23122;PARTY CHARMS 50 PIECES
229161;23123;COCKTAIL SWORDS 50 PIECES
229562;23124;18PC WOODEN CUTLERY SET DISPOSABLE
229769;23125;6PC WOOD PLATE SET DISPOSABLE
106887;23126;DOLLCRAFT GIRL AMELIE KIT
107799;23126;FELTCRAFT GIRL AMELIE KIT
113333;23126;DOLLCRAFT GIRL AMELIE
107601;23127;FELTCRAFT GIRL NICOLE KIT
106888;23127;DOLLCRAFT GIRL NICOLE
107798;23128;FELTCRAFT BOY JEAN-PAUL KIT
109319;23128;DOLLCRAFT BOY JEAN-PAUL 
194064;23129;HEART SHAPED HOLLY WREATH
171132;23130;MISTLETOE HEART WREATH GREEN
185631;23130;MISELTOE HEART WREATH 
185630;23131;MISELTOE HEART WREATH WHITE
283713;23131;MISELTOE HEART WREATH CREAM
168205;23131;MISTLETOE HEART WREATH CREAM
163602;23132;SMALL IVORY HEART WALL ORGANISER
164222;23133;LARGE IVORY HEART WALL ORGANISER
164221;23134;LARGE ZINC HEART WALL ORGANISER
163601;23135;SMALL ZINC HEART WALL ORGANISER
164860;23136;IVORY WIRE SWEETHEART LETTER TRAY
166019;23137;ZINC WIRE SWEETHEART LETTER TRAY
164867;23138;SINGLE WIRE HOOK IVORY HEART
164862;23139;SINGLE WIRE HOOK PINK HEART
163599;23140;TRIPLE WIRE HOOK IVORY HEART
163600;23141;TRIPLE WIRE HOOK PINK HEART
164856;23142;IVORY WIRE KITCHEN ORGANISER
173537;23143;ZINC WIRE KITCHEN ORGANISER
164765;23144;ZINC T-LIGHT HOLDER STARS SMALL
164938;23145;ZINC T-LIGHT HOLDER STAR LARGE
200236;23145;ZINC T-LIGHT HOLDER STARS LARGE
162792;23146;TRIPLE HOOK ANTIQUE IVORY ROSE
164710;23147;SINGLE ANTIQUE ROSE HOOK IVORY
171952;23148;MINITURE ANTIQUE ROSE HOOK IVORY
164711;23148;MINIATURE ANTIQUE ROSE HOOK IVORY
171869;23149;ANTIQUE IVORY WIRE BOWL SMALL
164870;23150;IVORY SWEETHEART SOAP DISH
174459;23151;ZINC SWEETHEART SOAP DISH
163942;23152;IVORY SWEETHEART WIRE LETTER RACK 
160859;23153;ZINC SWEETHEART WIRE LETTER RACK
132518;23154;SET OF 4 JAM JAR MAGNETS
132542;23155;KNICKERBOCKERGLORY MAGNET ASSORTED 
132519;23156;SET OF 5 MINI GROCERY MAGNETS
140211;23157;SET OF 6 NATIVITY MAGNETS 
133341;23158;SET OF 5 LUCKY CAT MAGNETS 
132517;23159;SET OF 5 PANCAKE DAY MAGNETS
171752;23160;REGENCY TEA SPOON
171753;23161;REGENCY CAKE FORK
169446;23162;REGENCY TEA STRAINER
168977;23163;REGENCY SUGAR TONGS
171754;23164;REGENCY CAKE SLICE
185639;23165;LARGE CERAMIC TOP STORAGE JAR
61289;23166;MEDIUM CERAMIC TOP STORAGE JAR
184789;23167;SMALL CERAMIC TOP STORAGE JAR 
185438;23168;CLASSIC SUGAR DISPENSER
186737;23168;CLASSIC CAFE SUGAR DISPENSER
185638;23169;CLASSIC GLASS SWEET JAR
186524;23169;CLASSIC GLASS COOKIE JAR
181330;23170;REGENCY TEA PLATE ROSES 
181329;23171;REGENCY TEA PLATE GREEN 
181328;23172;REGENCY TEA PLATE PINK
181327;23173;REGENCY TEAPOT ROSES 
181326;23174;REGENCY SUGAR BOWL GREEN
181325;23175;REGENCY MILK JUG PINK 
106516;23176;ABC TREASURE BOOK BOX 
106513;23177;TREASURE ISLAND BOOK BOX
107987;23178;JAM CLOCK MAGNET
107986;23179;CLOCK MAGNET MUM'S KITCHEN
108638;23180;MUM'S KITCHEN CLOCK
112400;23181;BULL DOG BOTTLE TOP WALL CLOCK
106137;23182;TOILET SIGN OCCUPIED OR VACANT
107985;23183;MOTHER'S KITCHEN SPOON REST 
109565;23184;BULL DOG BOTTLE OPENER
109320;23185;FRENCH STYLE STORAGE JAR JAM
113936;23186;FRENCH STYLE STORAGE JAR CAFE 
112756;23187;FRENCH STYLE STORAGE JAR BONBONS
224115;23188;VINTAGE  2 METER FOLDING RULER
376653;23188;VINTAGE  2 METRE FOLDING RULER
287598;23189;SET OF 12 FORK CANDLES
181051;23190;BUNDLE OF 3 SCHOOL EXERCISE BOOKS  
181308;23191;BUNDLE OF 3 RETRO EXERCISE BOOKS
181103;23191;BUNDLE OF 3 RETRO NOTE BOOKS
181167;23192;BUNDLE OF 3 ALPHABET EXERCISE BOOKS
106514;23193;BUFFALO BILL TREASURE BOOK BOX
107802;23194;GYMKHANA TREASURE BOOK BOX
106515;23194;GYMKHANNA TREASURE BOOK BOX
237581;23196;RETO LEAVES MAGNETIC SHOPPING LIST
251357;23196;VINTAGE LEAF MAGNETIC NOTEPAD
236012;23196;RETRO LEAVES MAGNETIC NOTEPAD
245318;23196;LEAVES MAGNETIC  SHOPPING LIST
237925;23197;VEGETABLE MAGNETIC  SHOPPING LIST
236011;23197;SKETCHBOOK MAGNETIC SHOPPING LIST
235247;23198;PANTRY MAGNETIC  SHOPPING LIST
152207;23199;JUMBO BAG APPLES
177156;23200;JUMBO BAG PEARS
152200;23201;JUMBO BAG ALPHABET
177155;23202;JUMBO BAG VINTAGE LEAF
290961;23203;JUMBO BAG VINTAGE DOILY 
289289;23203;JUMBO BAG VINTAGE DOILEY 
177488;23203;JUMBO BAG DOILEY PATTERNS
152209;23204;CHARLOTTE BAG APPLES DESIGN
152358;23205;CHARLOTTE BAG ALPHABET  DESIGN
152199;23205;CHARLOTTE BAG VINTAGE ALPHABET 
152208;23206;LUNCH BAG APPLE DESIGN
152201;23207;LUNCH BAG ALPHABET DESIGN
152405;23208;LUNCH BAG VINTAGE LEAF DESIGN
289291;23209;LUNCH BAG VINTAGE DOILEY 
290983;23209;LUNCH BAG VINTAGE DOILY 
177899;23209;LUNCH BAG DOILEY PATTERN 
209226;23210;WHITE ROCKING HORSE HAND PAINTED
209280;23211;RED ROCKING HORSE HAND PAINTED
209228;23212;HEART WREATH DECORATION WITH BELL
334206;23212;PAINTED HEART WREATH WITH BELL
209227;23213;STAR WREATH DECORATION WITH BELL
208082;23214;JINGLE BELL HEART ANTIQUE GOLD
244791;23214;BELL HEART ANTIQUE GOLD
208083;23215;JINGLE BELL HEART ANTIQUE SILVER
209286;23216;LAUREL HEART ANTIQUE GOLD
209287;23217;LAUREL HEART ANTIQUE SILVER
266215;23218;LAUREL STAR ANTIQUE GOLD
209241;23219;LAUREL STAR ANTIQUE SILVER 
219289;23220;REINDEER HEART DECORATION GOLD
207695;23221;REINDEER HEART DECORATION SILVER
235615;23222;CHRISTMAS TREE HANGING GOLD
235613;23223;CHRISTMAS TREE HANGING SILVER 
209242;23224;CHERUB HEART DECORATION GOLD
209288;23225;CHERUB HEART DECORATION SILVER 
206718;23226;FILIGREE HEART DAISY WHITE
204019;23227;FILIGREE HEART BUTTERFLY WHITE 
203816;23228;FILIGREE HEART BIRD WHITE 
225134;23229;DONKEY TAIL GAME 
224551;23229;VINTAGE DONKEY TAIL GAME 
55625;23230;WRAP ALPHABET DESIGN
293830;23231;WRAP  VINTAGE DOILY 
289834;23231;WRAP  VINTAGE DOILEY 
54864;23231;WRAP DOILEY DESIGN
234808;23232;WRAP VINTAGE LEAF DESIGN
58989;23232;WRAP VINTAGE PETALS  DESIGN
58183;23233;WRAP POPPIES  DESIGN
224598;23234;BISCUIT TIN VINTAGE CHRISTMAS
224123;23235;BISCUIT TIN VINTAGE LEAF
217094;23235;STORAGE TIN VINTAGE LEAF
289082;23236;STORAGE TIN VINTAGE DOILEY 
291096;23236;STORAGE TIN VINTAGE DOILY 
219173;23236;DOILEY BISCUIT TIN
217093;23236;DOILEY STORAGE TIN
248533;23237;SET OF 4 KNICK KNACK TINS LEAF
217332;23237;SET OF 4 KNICK KNACK TINS LEAVES 
215602;23238;SET OF 4 KNICK KNACK TINS LONDON 
217092;23239;SET OF 4 KNICK KNACK TINS POPPIES
215045;23240;SET OF 4 KNICK KNACK TINS DOILEY 
293988;23240;SET OF 4 KNICK KNACK TINS  DOILEY 
290475;23240;SET OF 4 KNICK KNACK TINS DOILY 
217125;23241;TREASURE TIN GYMKHANA DESIGN
217126;23242;TREASURE TIN BUFFALO BILL 
216344;23243;SET OF TEA COFFEE SUGAR TINS PANTRY
224125;23244;CANNISTER VINTAGE LEAF DESIGN
218891;23244;STORAGE TIN VINTAGE LEAF
217330;23244;ROUND STORAGE TIN VINTAGE LEAF
216831;23245;SET OF 3 REGENCY CAKE TINS
217205;23247;BISCUIT TIN 50'S CHRISTMAS
224148;23249;VINTAGE RED ENAMEL TRIM PLATE
326038;23249;ENAMEL DINNER PLATE PANTRY
224149;23250;VINTAGE RED TRIM ENAMEL BOWL 
261935;23250;ENAMEL BOWL PANTRY
224147;23251;VINTAGE RED ENAMEL TRIM MUG 
261936;23251;ENAMEL MUG PANTRY
221753;23252;VINTAGE RED ENAMEL TRIM JUG 
261934;23252;ENAMEL JUG PANTRY
159420;23253;16 PIECE CUTLERY SET PANTRY DESIGN
200687;23253;16 PC CUTLERY SET PANTRY DESIGN
147537;23254;CHILDRENS CUTLERY DOLLY GIRL 
152361;23254;KIDS CUTLERY DOLLY GIRL 
150505;23255;CHILDRENS CUTLERY CIRCUS PARADE
147538;23256;CHILDRENS CUTLERY SPACEBOY 
152360;23256;KIDS CUTLERY SPACEBOY 
210015;23263;SET OF 3 WOODEN HEART DECORATIONS
219687;23264;SET OF 3 WOODEN SLEIGH DECORATIONS
219688;23265;SET OF 3 WOODEN TREE DECORATIONS
219689;23266;SET OF 3 WOODEN STOCKING DECORATION
236502;23267;SET OF 4 SANTA PLACE SETTINGS
221692;23268;SET OF 2 CERAMIC CHRISTMAS REINDEER
221691;23269;SET OF 2 CERAMIC CHRISTMAS TREES
210726;23270;SET OF 2 CERAMIC PAINTED HEARTS 
238371;23271;CHRISTMAS TABLE SILVER CANDLE SPIKE
223886;23271;CHRISTMAS TABLE CANDLE SILVER SPIKE
234733;23272;TREE T-LIGHT HOLDER WILLIE WINKIE
212538;23273;HEART T-LIGHT HOLDER WILLIE WINKIE
212539;23274;STAR T-LIGHT HOLDER WILLIE WINKIE
209959;23275;SET OF 3 HANGING OWLS OLLIE BEAK
181050;23280;FOLDING BUTTERFLY MIRROR HOT PINK 
184224;23280;FOLDING MIRROR HOT PINK 
182117;23281;FOLDING BUTTERFLY MIRROR RED  
187998;23281;FOLDING MIRROR RED  
181049;23282;FOLDING BUTTERFLY MIRROR IVORY 
187997;23282;FOLDING MIRROR IVORY 
249896;23283;DOORMAT VINTAGE LEAF
169056;23283;DOORMAT VINTAGE LEAVES DESIGN 
168989;23284;DOORMAT KEEP CALM AND COME IN
222172;23285;PINK VINTAGE SPOT BEAKER
222036;23286;BLUE VINTAGE SPOT BEAKER
224025;23287;RED VINTAGE SPOT BEAKER
222173;23288;GREEN VINTAGE SPOT BEAKER
224023;23289;DOLLY GIRL CHILDRENS BOWL
224024;23290;SPACEBOY CHILDRENS BOWL
224022;23291;DOLLY GIRL CHILDRENS CUP
228991;23292;SPACEBOY CHILDRENS CUP
224021;23292;SPACE BOY CHILDRENS CUP
259001;23293;SET OF 12 FAIRY CAKE BAKING CASES
259000;23294;SET OF 6 SNACK LOAF BAKING CASES
259002;23295;SET OF 12 MINI LOAF BAKING CASES
258999;23296;SET OF 6 TEA TIME BAKING CASES
259003;23297;SET 40 HEART SHAPE PETIT FOUR CASES
176127;23298;BUNTING , SPOTTY 
173605;23298;SPOTTY BUNTING
179024;23299;FOOD COVER WITH BEADS , SET 2 SIZES
173604;23299;FOOD COVER WITH BEADS SET 2 
188906;23300;GARDENERS KNEELING PAD CUP OF TEA 
188905;23301;GARDENERS KNEELING PAD KEEP CALM 
189475;23302;KNEELING MAT HOUSEWORK  DESIGN
417922;23303;SET 4 PICNIC CUTLERY FONDANT
423470;23304;SET 4 PICNIC CUTLERY CHERRY 
411128;23305;SET 4 PICNIC CUTLERY BLUEBERRY
211823;23306;SET OF 36 DOILIES PANTRY DESIGN
416100;23306;SET OF 36 PANTRY PAPER DOILIES
211057;23307;SET OF 60 PANTRY DESIGN CAKE CASES 
212528;23308;SET OF 60 VINTAGE LEAF CAKE CASES 
210140;23309;SET OF 60 I LOVE LONDON CAKE CASES 
219061;23310;BUBBLEGUM RING ASSORTED
262207;23311;VINTAGE CHRISTMAS STOCKING 
264975;23312;VINTAGE CHRISTMAS GIFT SACK
258884;23313;VINTAGE CHRISTMAS BUNTING
263316;23314;VINTAGE CHRISTMAS TABLECLOTH
237312;23315;IVORY REFECTORY CLOCK
237313;23316;RED REFECTORY CLOCK 
239015;23317;BLUE REFECTORY CLOCK 
246268;23318;BOX OF 6 MINI VINTAGE CRACKERS
252681;23319;BOX OF 6 MINI 50'S CRACKERS
248698;23320;GIANT 50'S CHRISTMAS CRACKER
219160;23321;SMALL WHITE HEART OF WICKER
221819;23322;LARGE WHITE HEART OF WICKER
237235;23323;WHITE WICKER STAR 
290566;23324;RUSTIC STRAWBERRY JAMPOT LARGE 
301228;23324;RUSTIC STRAWBERRY JAM POT LARGE 
297387;23325;RUSTIC STRAWBERRY JAMPOT SMALL
299966;23325;RUSTIC STRAWBERRY JAM POT SMALL
296690;23326;HANGING MINI COLOURED BOTTLES
295027;23327;HANGING CLEAR MINI BOTTLE
293060;23328;SET 6 SCHOOL MILK BOTTLES IN CRATE
291642;23329;DECORATIVE WICKER HEART LARGE
292513;23330;DECORATIVE WICKER HEART MEDIUM
295026;23331;DECORATIVE WICKER HEART SMALL
291641;23332;IVORY WICKER HEART LARGE
292595;23333;IVORY WICKER HEART MEDIUM
292593;23334;IVORY WICKER HEART SMALL
224008;23335;EGG FRYING PAN IVORY 
224010;23336;EGG FRYING PAN PINK 
224011;23337;EGG FRYING PAN MINT 
222171;23338;EGG FRYING PAN RED 
224009;23339;EGG FRYING PAN BLUE 
283673;23340;VINTAGE CHRISTMAS CAKE FRILL
237576;23341;PINK DINER WALL CLOCK
237575;23342;MINT DINER WALL CLOCK
322680;23342;MINT DINER CLOCK
223098;23343;JUMBO BAG VINTAGE CHRISTMAS 
226522;23344;JUMBO BAG 50'S CHRISTMAS 
275356;23345; DOLLY GIRL BEAKER
275355;23346;SPACEBOY BEAKER
275378;23347;I LOVE LONDON BEAKER
159909;23348;CHILDRENS TOY COOKING UTENSIL SET
288852;23349;ROLL WRAP VINTAGE CHRISTMAS
288854;23350;ROLL WRAP VINTAGE SPOT 
288979;23351;ROLL WRAP 50'S CHRISTMAS
288978;23352;ROLL WRAP 50'S RED CHRISTMAS 
285626;23353;6 GIFT TAGS VINTAGE CHRISTMAS 
285700;23354;6 GIFT TAGS 50'S CHRISTMAS 
307074;23355;HOT WATER BOTTLE KEEP CALM
306898;23356;LOVE HOT WATER BOTTLE
306069;23357;HOT WATER BOTTLE SEX BOMB
306111;23358;HOT STUFF HOT WATER BOTTLE
285462;23359;SET OF 12 T-LIGHTS VINTAGE DOILEY
296318;23359;SET OF 12 T-LIGHTS VINTAGE DOILY
291089;23360;SET 8 CANDLES VINTAGE DOILY
285414;23360;SET 8 CANDLES VINTAGE DOILEY
351547;23365;SET 12 COLOUR PENCILS LOVE LONDON
377975;23366;SET 12 COLOURING PENCILS DOILEY
351494;23366;SET 12 COLOUR PENCILS DOILEY
351410;23366;SET 12 COLOURING PENCILS DOILY
351411;23367;SET 12 COLOUR PENCILS SPACEBOY 
351829;23368;SET 12 COLOUR PENCILS DOLLY GIRL 
351548;23369;SET 36 COLOUR PENCILS LOVE LONDON
377973;23370;SET 36 COLOURING PENCILS DOILEY
351797;23370;SET 36 COLOURING PENCILS DOILY
351493;23370;SET 36 COLOUR PENCILS DOILEY
351483;23371;SET 36 COLOUR PENCILS SPACEBOY 
352204;23372;SET 36 COLOUR PENCILS DOLLY GIRL
285613;23373;VINTAGE CHRISTMAS PAPER GIFT BAG
285759;23374;RED SPOT PAPER GIFT BAG
306605;23375;50'S CHRISTMAS PAPER GIFT BAG
319069;23376;PACK OF 12 VINTAGE CHRISTMAS TISSUE
323139;23377;PACK OF 12 DOLLY GIRL TISSUES
319076;23378;PACK OF 12 50'S CHRISTMAS TISSUES
324614;23379;PACK OF 12 RED APPLE TISSUES
324617;23380;PACK OF 12 VINTAGE DOILY TISSUES
351495;23380;PACK OF 12 DOILEY TISSUES
324616;23381;PACK OF 12 VINTAGE LEAF TISSUES 
393865;23382;BOX OF 6 CHRISTMAS CAKE DECORATIONS
377982;23388;WOODLAND MINI RUCKSACK 
334113;23388;WOODLAND MINI BACKPACK
332953;23389;SPACEBOY MINI BACKPACK
355332;23389;SPACEBOY MINI RUCKSACK
332913;23390;DOLLY GIRL MINI BACKPACK
355331;23390;DOLLY GIRL MINI RUCKSACK
377968;23391; I LOVE LONDON MINI RUCKSACK
332509;23391; I LOVE LONDON MINI BACKPACK
325803;23392;SPACEBOY ROCKET LOLLY MAKERS
322996;23393;HOME SWEET HOME CUSHION COVER 
322994;23394;POSTE FRANCE CUSHION COVER
322993;23395;BELLE JARDINIERE CUSHION COVER
343495;23396;LE JARDIN BOTANIQUE CUSHION COVER
323718;23396;LA JARDIN BOTANIQUE CUSHION COVER
322992;23396;BUTTERFLY CUSHION COVER
323099;23397;FOOT STOOL HOME SWEET HOME 
323619;23398;HANGING HEART BONHEUR
323200;23399;HOME SWEET HOME HANGING HEART
325887;23400;SHELF WITH 4 HOOKS HOME SWEET HOME
328579;23401;RUSTIC MIRROR WITH LACE HEART
324640;23402;HOME SWEEET HOME 3 PEG HANGER 
328270;23402;HOME SWEET HOME 3 PEG HANGER 
324641;23403;LETTER HOLDER HOME SWEET HOME
324263;23404;HOME SWEET HOME BLACKBOARD
324411;23405;HOME SWEET HOME 2 DRAWER CABINET
324267;23406;HOME SWEET HOME KEY HOLDER
322995;23407;SET OF 2 TRAYS HOME SWEET HOME
328571;23408;PHOTO FRAME LINEN AND LACE SMALL
328327;23409;PHOTO FRAME LINEN AND LACE LARGE
329164;23410;CURIO CABINET LINEN AND LACE 
323618;23411; TRELLIS COAT RACK
325730;23412;HEART MIRROR ANTIQUE WHITE
328326;23413;VINTAGE COFFEE GRINDER BOX
403260;23413;DECROTIVEVINTAGE COFFEE GRINDER BOX
416034;23413;DECORATIVE VINTAGE COFFEE  BOX
323954;23414;ZINC BOX SIGN HOME
328264;23415;HOME SWEET HOME HOOK
335047;23416;CHAMBRE HOOK
328265;23417;BATHROOM HOOK
332263;23418;LAVENDER TOILETTE BOTTLE
332264;23419;HOME SWEET HOME BOTTLE 
340531;23420;PANTRY HOOK TEA STRAINER 
330004;23421;PANTRY HOOK SPATULA
328759;23422;PANTRY HOOK BALLOON WHISK 
330001;23423;PANTRY 3 HOOK ROLLING PIN HANGER
323958;23424;GINGHAM RECIPE BOOK BOX
323941;23425;STORAGE TIN HOME SWEET HOME
325405;23426;METAL SIGN DROP YOUR PANTS
322997;23427;STOOL HOME SWEET HOME 
473389;23428;IVORY RETRO KITCHEN WALL CLOCK
483384;23429;RED RETRO KITCHEN WALL CLOCK
482754;23430;BLUE RETRO KITCHEN WALL CLOCK
312338;23431;NATURAL HANGING QUILTED HEARTS 
317921;23432;PRETTY HANGING QUILTED HEARTS
312666;23433;HANGING QUILTED PATCHWORK APPLES
332306;23434;3 RAFFIA RIBBONS 50'S CHRISTMAS 
332107;23435;3 RAFFIA RIBBONS VINTAGE CHRISTMAS
303175;23436;VINTAGE CHRISTMAS GIFT BAG LARGE 
285614;23436;GIFT BAG LARGE VINTAGE CHRISTMAS
307532;23437; 50'S CHRISTMAS GIFT BAG LARGE
325056;23437;GIFT BAG LARGE 50'S CHRISTMAS
286920;23438; RED SPOT GIFT BAG LARGE
288856;23438;GIFT BAG LARGE SPOT 
310262;23439;HAND WARMER RED LOVE HEART
496491;23440;PAINT YOUR OWN EGGS IN CRATE
490179;23441;HAND PAINTED HANGING EASTER EGG
468842;23442;12 HANGING EGGS HAND PAINTED
204461;23444;Next Day Carriage
309718;23445;ICE CREAM BUBBLES
386356;23446;BLUE BUNNY EASTER EGG BASKET
386355;23447;PINK BUNNY EASTER EGG BASKET
386354;23448;CREAM BUNNY EASTER EGG BASKET
468844;23449;SET OF 6 EASTER RAINBOW CHICKS
396152;23451;SQUARE MINI PORTRAIT FRAME
396055;23452;HEART MINI PORTRAIT FRAME
395684;23453;OVAL  MINI PORTRAIT FRAME
409342;23454;SET OF 3 MINI HANGING PORTRAITS
411715;23454;THREE MINI HANGING FRAMES
456602;23455;SMALL PARLOUR FRAME
397892;23455;SMALL PARLOUR PICTURE FRAME
456601;23456;MEDIUM PARLOUR FRAME 
397125;23456;MEDIUM PARLOUR PICTURE FRAME 
456600;23457;LARGE PARLOUR FRAME
397870;23457;LARGE PARLOUR PICTURE FRAME
400481;23458;DOLLY CABINET 3 DRAWERS 
397064;23459;DOLLY CABINET 2 DRAWERS 
407369;23460;SWEETHEART WALL TIDY 
366596;23461;SWEETHEART BIRD HOUSE
408423;23462;ROCOCO WALL MIROR
407410;23462;ROCOCO WALL MIRROR WHITE
397192;23463;VINTAGE ZINC WATERING CAN
397193;23464;VINTAGE ZINC WATERING CAN SMALL
375452;23465;TUSCAN VILLA FEEDING STATION
453945;23465;TUSCAN VILLA BIRD FEEDER
367133;23466;TUSCAN VILLA DOVECOTE
384701;23466;TUSCAN VILLA DOVECOTE BIRD FEEDER
398278;23467;VINTAGE ZINC PLANTER  
380642;23468;TUSCAN VILLA BIRD TABLE 
367281;23469;CARD HOLDER LOVE BIRD SMALL
369441;23470;CARD HOLDER LOVE BIRD LARGE 
368621;23471;SIX DRAWER OFFICE TIDY
369206;23472; NINE DRAWER OFFICE TIDY
407138;23473;WOODLAND SMALL RED FELT HEART
412543;23474;WOODLAND SMALL BLUE FELT HEART
420726;23475;WOODLAND SMALL PINK FELT HEART
406954;23476;WOODLAND LARGE RED FELT HEART
406952;23477;WOODLAND LARGE BLUE FELT HEART
406953;23478;WOODLAND LARGE PINK FELT HEART
399054;23479;WIRE EGG BASKET 
405726;23480;MINI LIGHTS WOODLAND MUSHROOMS
400272;23481;PEARLISED IVORY HEART SMALL 
396161;23482;PEARLISED IVORY HEART LARGE 
371433;23483;HANGING  BUTTERFLY T-LIGHT HOLDER
375045;23484;HEART TRELLIS TRIPLE T-LIGHT HOLDER
367401;23484;HEART TRELLISTRIPLE T-LIGHT HOLDER
408054;23485;BOTANICAL GARDENS WALL CLOCK 
407086;23486;ANTIQUE HEART SHELF UNIT
395412;23487;SWEET HEART CAKE CARRIER
406422;23489;GARLAND, VINTAGE BELLS
408065;23489;VINTAGE BELLS GARLAND
395682;23490;T-LIGHT HOLDER HANGING LOVE BIRD
406423;23491;VINTAGE JINGLE BELLS HEART
406424;23492;VINTAGE JINGLE BELLS WREATH
351546;23493;VINTAGE DOILY TRAVEL SEWING KIT
356778;23494;VINTAGE DOILY DELUXE SEWING KIT 
423748;23495;SET OF 3 PANTRY WOODEN SPOONS
423754;23496;PANTRY KITCHEN THERMOMETER 
422394;23497;CLASSIC CHROME BICYCLE BELL 
449522;23497;CLASSIC CROME BICYCLE BELL 
497484;23498;CLASSIC BICYCLE CLIPS 
407685;23499;SET 12 VINTAGE DOILY CHALK 
374220;23500;KEY RING BASEBALL BOOT ASSORTED 
375979;23501;KEY RING BASEBALL BOOT UNION JACK
351492;23502;PLAYING CARDS VINTAGE DOILEY 
355433;23502;PLAYING CARDS VINTAGE DOILY 
351054;23503;PLAYING CARDS KEEP CALM & CARRY ON
351418;23504;PLAYING CARDS JUBILEE UNION JACK
351882;23505;PLAYING CARDS I LOVE LONDON 
351485;23506;MINI PLAYING CARDS SPACEBOY 
352256;23507;MINI PLAYING CARDS BUFFALO BILL 
352254;23508;MINI PLAYING CARDS DOLLY GIRL 
352255;23509;MINI PLAYING CARDS FUN FAIR 
352253;23510;MINI PLAYING CARDS GYMKHANA
351609;23511;EMBROIDERED RIBBON REEL EMILY 
352233;23512;EMBROIDERED RIBBON REEL ROSIE
352351;23513;EMBROIDERED RIBBON REEL SUSIE 
352235;23514;EMBROIDERED RIBBON REEL SALLY 
352234;23515;EMBROIDERED RIBBON REEL DAISY 
356721;23516;EMBROIDERED RIBBON REEL SOPHIE  
351619;23517;EMBROIDERED RIBBON REEL REBECCA 
352237;23518;EMBROIDERED RIBBON REEL RACHEL 
356722;23519;EMBROIDERED RIBBON REEL CLAIRE
351608;23520;EMBROIDERED RIBBON REEL RUBY 
371232;23521;CAT AND BIRD WALL ART
375166;23521;WALL ART CAT AND BIRD 
378531;23522;WALL ART DOG AND BALL 
371047;23522;DOG AND BALL WALL ART
387184;23523;WALL ART TREASURE AHOY 
371233;23523;TREASURE AHOY WALL ART
374373;23524;WALL ART HORSE & PONY 
369654;23524;HORSE & PONY WALL ART
370365;23525;BUFFALO BILL WALL ART 
371846;23525;WALL ART BUFFALO BILL 
371050;23526;DOG LICENCE WALL ART
372453;23526;WALL ART DOG LICENCE 
371302;23527;ANIMALS AND NATURE WALL ART
374375;23527;WALL ART ANIMALS AND NATURE 
371053;23528;SPACEBOY WALL ART
372454;23528;WALL ART SPACEBOY
371437;23529;DOLLY GIRL WALL ART
377494;23529;WALL ART DOLLY GIRL 
371230;23530;WALL ART ONLY ONE PERSON 
379679;23530;WALL ART,ONLY ONE PERSON 
371235;23531;WALL ART BIG LOVE 
370369;23532;WALL ART WORK REST AND PLAY  
371051;23533;WALL ART GARDEN HAVEN 
369848;23534;STOP FOR TEA WALL ART
371925;23534;WALL ART STOP FOR TEA 
376510;23535;WALL ART BICYCLE SAFETY
371763;23535;WALL ART BICYCLE SAFTEY 
369847;23535;BICYCLE SAFTEY WALL ART
371624;23536;VILLAGE SHOW WALL ART
371924;23536;WALL ART VILLAGE SHOW 
371716;23537;I LOVE LONDON WALL ART
373296;23537;WALL ART I LOVE LONDON 
371231;23538;WALL ART VINTAGE HEART
370370;23539;WALL ART LOVES' SECRET 
379678;23539;WALL ART , LOVES' SECRET 
386066;23540;WALL ART , THE MAGIC FOREST 
371713;23540;WALL ART THE MAGIC FOREST 
369849;23541;WALL ART CLASSIC PUDDINGS 
379680;23541;WALL ART ,PUDDINGS 
371052;23542;70'S ALPHABET WALL ART
373441;23542;WALL ART 70'S ALPHABET 
371762;23543;WALL ART KEEP CALM 
371074;23543;KEEP CALM WALL ART 
371626;23544;WALL ART MID CENTURY MODERN 
298051;23545;WRAP RED VINTAGE DOILY
270231;23545;WRAP RED DOILEY
268336;23546;WRAP PAISLEY PARK 
270502;23547;WRAP FLOWER SHOP  
270505;23548;WRAP MAGIC FOREST 
268335;23549;WRAP BIRD GARDEN 
266079;23550;WRAP ALPHABET POSTER  
319874;23551;PACK OF 12 PAISLEY PARK TISSUES 
497483;23552;BICYCLE PUNCTURE REPAIR KIT 
406397;23553;LANDMARK FRAME CAMDEN TOWN 
404905;23554;LANDMARK FRAME OXFORD STREET
405446;23555;LANDMARK FRAME NOTTING HILL 
404904;23556;LANDMARK FRAME COVENT GARDEN 
405198;23557;LANDMARK FRAME BAKER STREET 
404902;23558;LANDMARK FRAME LONDON BRIDGE 
329914;23559;WOODLAND BUNNIES LOLLY MAKERS
500761;23560;SET OF 6 RIBBONS COUNTRY STYLE
501666;23561;SET OF 6 RIBBONS PARTY
501165;23562;SET OF 6 RIBBONS PERFECTLY PRETTY  
393896;23564;EGG CUP MILKMAID INGRID
397080;23565;EGG CUP MILKMAID HELGA 
398275;23566;EGG CUP MILKMAID HEIDI
395128;23567;EGG CUP HENRIETTA HEN PINK
398025;23568;EGG CUP HENRIETTA HEN CREAM 
409858;23569;TRADTIONAL ALPHABET STAMP SET
409339;23570;TRADITIONAL PICK UP STICKS GAME 
409641;23571;TRADITIONAL NAUGHTS & CROSSES
251111;23574;PACKING CHARGE
500758;23575;SNACK TRAY PAISLEY PARK
500938;23576;SNACK TRAY RED VINTAGE DOILY
500534;23578;SNACK TRAY RED GINGHAM
402046;23579;SNACK TRAY I LOVE LONDON
500713;23580;SNACK TRAY HAPPY FOREST  
414919;23581;JUMBO BAG PAISLEY PARK
414754;23582;VINTAGE DOILY JUMBO BAG RED 
414778;23583;LUNCH BAG PAISLEY PARK  
454160;23597;PAPER BUNTING PAISLEY PARK
454146;23598;PAPER BUNTING VINTAGE PARTY
356241;23601;SET 10 CARDS SNOWY SNOWDROPS  17100
457379;23602;SET 10 CARDS 3 WISE MEN 17107
396585;23603;SET 10 CARD KRAFT REINDEER 17084
372457;23604;SET 10 MINI SANTA & SNOWMAN  17087
377727;23605;SET 10 CARDS 12 DAYS OF XMAS 17059
337929;23607;SET 10 CARDS HATS & STOCKINGS 17081
435493;23608;SET 10 CARDS RUDOLPHS NOSE 17097
505429;23609;SET 10 CARDS SNOWY ROBIN 17099
355978;23610;SET 10 CARDS CHRISTMAS ROBIN 17095
335646;23611;SET 10 CARDS RED RIDING HOOD 17214
380292;23612;SET 10 MINICARDS CUTE SNOWMAN 17071
328763;23613;SET 10 XMAS CARDS & BADGES 17070
327282;23614;SET 10 CARDS 12 DAYS WRAP  17058
421111;23615;SET 10 CARDS PRINTED GRAPHIC 17219
451020;23616;SET 10 CARDS JINGLE BELLS 17217
510145;23617;SET 10 CARDS SWIRLY XMAS TREE 17104
377728;23619;SET 10 CARDS POINSETTIA 17093
322473;23620;SET 10 CARDS PERFECT POST 17090
455310;23621;SET 10 CARDS DAVID'S MADONNA 17074
322474;23623;SET 10 CARD CHRISTMAS WELCOME 17112
352924;23624;SET 10 CARD PERFECT NATIVITY 17089
341398;23625;SET 6 CARDS SPARKLY REINDEER 17262
372459;23626;SET 10 CARDS DINKY TREE 17076
455312;23627;SET 10 CARDS XMAS GRAPHIC  17218
428971;23628;SET 10 CARDS TRIANGLE ICONS  17220
350711;23629;SET 10 CARDS DRESSING UP 17077
350886;23630;SET 10 CARDS HANGING BAUBLES 17080
356244;23632;SET 10 CARDS CHEERFUL ROBIN 17065
428972;23633;SET 10 CARDS WORLD CHILDREN 17067
322475;23634;SET 10 CARDS XMAS CHOIR 17068
377732;23635;SET 10 CARDS CHRISTMAS HOLLY  17259
413670;23636;SET 10 CARDS WISHING TREE 17116
